Symbol,Name,Last Sale,Net Change,% Change,Market Cap,Country,IPO Year,Volume,Sector,Industry
JBHT,J.B. Hunt Transport Services Inc. Common Stock,$157.47,0.17,0.108%,16500243258.00,United States,,580566,Industrials,Trucking Freight/Courier Services
JBLU,JetBlue Airways Corporation Common Stock,$8.37,-0.59,-6.585%,2685004164.00,United States,2002,11026745,Consumer Discretionary,Air Freight/Delivery Services
JBSS,John B. Sanfilippo & Son Inc. Common Stock,$72.49,0.09,0.124%,835515826.00,United States,1991,47036,Consumer Staples,Specialty Foods
JCIC,Jack Creek Investment Corp. Class A Ordinary Shares,$9.83,0.00,0.00%,423918750.00,United States,2021,15265,Finance,Business Services
JCICU,Jack Creek Investment Corp. Units,$9.855,-0.005,-0.051%,0.00,United States,2021,100,Finance,Business Services
JCICW,Jack Creek Investment Corp. Warrants,$0.08,0.01,14.286%,0.00,United States,2021,484,Finance,Business Services
JCSE,JE Cleantech Holdings Limited Ordinary Shares,$12.50,0.19,1.543%,187750000.00,Singapore,2022,16872,,
JCTCF,Jewett-Cameron Trading Company Common Shares,$6.30,-0.05,-0.787%,22004905.00,United States,,440,,
JD,JD.com Inc. American Depositary Shares,$64.22,-0.63,-0.971%,100295430487.00,China,2014,5555879,Consumer Discretionary,Catalog/Specialty Distribution
JFIN,Jiayin Group Inc. American Depositary Shares,$2.24,0.11,5.164%,121016000.00,China,2019,64858,Finance,Finance: Consumer Services
JFU,9F Inc. American Depositary Shares,$0.87,-0.15,-14.706%,202037194.00,China,2019,108173,Finance,Finance: Consumer Services
JG,Aurora Mobile Limited American Depositary Shares,$1.06,0.04,3.922%,125800090.00,China,2018,184824,Technology,EDP Services
JGGC,Jaguar Global Growth Corporation I Class A Ordinary Shares,$9.94,0.03,0.303%,304826670.00,United States,2022,165,,
JGGCR,Jaguar Global Growth Corporation I Right,$0.18,0.02,12.50%,0.00,United States,2022,10000,,
JGGCU,Jaguar Global Growth Corporation I Unit,$10.25,0.15,1.485%,0.00,United States,2022,1444,,
JGGCW,Jaguar Global Growth Corporation I Warrant,$0.15,0.00,0.00%,0.00,United States,2022,5,,
JJSF,J & J Snack Foods Corp. Common Stock,$139.66,1.23,0.889%,2677969327.00,United States,1986,107292,Consumer Staples,Specialty Foods
JKHY,Jack Henry & Associates Inc. Common Stock,$180.02,-2.10,-1.153%,13116582496.00,United States,1985,930700,Technology,Retail: Computer Software & Peripheral Equipment
JMAC,Maxpro Capital Acquisition Corp. Class A Common Stock,$10.08,0.00,0.00%,135349452.00,Taiwan,2021,102,Industrials,Consumer Electronics/Appliances
JMACU,Maxpro Capital Acquisition Corp. Units,$10.12,-0.04,-0.394%,0.00,Taiwan,2021,1171,Industrials,Consumer Electronics/Appliances
JMACW,Maxpro Capital Acquisition Corp. Warrants,$0.095,0.005,5.556%,0.00,Taiwan,2021,700,Industrials,Consumer Electronics/Appliances
JMSB,John Marshall Bancorp Inc. Common Stock,$22.54,0.22,0.986%,315526348.00,United States,,65472,Finance,Major Banks
JNCE,Jounce Therapeutics Inc. Common Stock,$3.03,-0.01,-0.329%,156573238.00,United States,2017,289674,Health Care,Biotechnology: Pharmaceutical Preparations
JOAN,JOANN Inc. Common Stock,$7.75,0.01,0.129%,315172614.00,United States,2021,466374,Consumer Discretionary,Department/Specialty Retail Stores
JOFF,JOFF Fintech Acquisition Corp. Class A Common Stock,$9.83,0.03,0.306%,508702500.00,United States,2021,229,Industrials,Consumer Electronics/Appliances
JOFFU,JOFF Fintech Acquisition Corp. Unit,$9.79,-0.05,-0.508%,0.00,United States,2021,1000,Industrials,Consumer Electronics/Appliances
JOFFW,JOFF Fintech Acquisition Corp. Warrant,$0.11,0.00,0.00%,0.00,United States,2021,7200,Industrials,Consumer Electronics/Appliances
JOUT,Johnson Outdoors Inc. Class A Common Stock,$61.16,-0.36,-0.585%,621874024.00,United States,,14757,Consumer Discretionary,Recreational Games/Products/Toys
JRSH,Jerash Holdings (US) Inc. Common Stock,$4.71,-0.10,-2.079%,58094638.00,United States,2018,39620,Consumer Discretionary,Industrial Specialties
JRVR,James River Group Holdings Ltd. Common Shares,$24.78,0.20,0.814%,928017542.00,Bermuda,2014,166717,Finance,Property-Casualty Insurers
JSM,Navient Corporation 6% Senior Notes due December 15 2043,$18.40,-1.46,-7.351%,0.00,United States,,231334,Finance,Finance: Consumer Services
JSPR,Jasper Therapeutics Inc. Common Stock,$1.93,-0.02,-1.026%,73101230.00,United States,2020,4839,Health Care,Biotechnology: Pharmaceutical Preparations
JSPRW,Japer Therapeutics Inc. Warrants,$0.091,-0.004,-4.211%,0.00,United States,2020,3078,Health Care,Biotechnology: Pharmaceutical Preparations
JUGG,Jaws Juggernaut Acquisition Corporation Class A Ordinary Share,$9.73,0.01,0.103%,335685000.00,United States,2021,475744,,
JUGGU,Jaws Juggernaut Acquisition Corporation Unit,$9.78,0.00,0.00%,0.00,United States,2021,20,,
JUGGW,Jaws Juggernaut Acquisition Corporation Warrant,$0.3701,-0.0299,-7.475%,0.00,United States,2021,101400,,
JUPW,Jupiter Wellness Inc. Common Stock,$0.7248,-0.006,-0.821%,16055427.00,United States,2020,118798,Health Care,Biotechnology: Pharmaceutical Preparations
JUPWW,Jupiter Wellness Inc. Warrant,$0.5001,0.00,0.00%,0.00,United States,2020,1003,Health Care,Biotechnology: Pharmaceutical Preparations
JVA,Coffee Holding Co. Inc. Common Stock,$2.44,0.0699,2.949%,13928982.00,United States,2005,8047,Consumer Staples,Specialty Foods
JWACR,Jupiter Wellness Acquisition Corp. Right,$0.1201,-0.0049,-3.92%,0.00,United States,2022,20800,,
JWEL,Jowell Global Ltd. Ordinary Shares,$2.62,-0.38,-12.667%,68548278.00,China,2021,80649,Consumer Discretionary,Other Consumer Services
JYAC,Jiya Acquisition Corp. Class A Common Stock,$9.88,0.01,0.101%,132857259.00,United States,2020,100503,Industrials,Consumer Electronics/Appliances
JYNT,The Joint Corp. Common Stock,$15.31,-0.09,-0.584%,221402993.00,United States,2014,250608,,
JZXN,Jiuzi Holdings Inc. Ordinary Shares,$0.8776,-0.0384,-4.192%,18804198.00,China,2021,51548,Consumer Discretionary,Retail-Auto Dealers and Gas Stations
KACL,Kairous Acquisition Corp. Limited Ordinary Shares,$9.95,0.03,0.302%,100954123.00,Malaysia,2022,2987,,
KACLR,Kairous Acquisition Corp. Limited Rights,$0.12,0.0049,4.257%,0.00,Malaysia,2022,99610,,
KACLU,Kairous Acquisition Corp. Limited Unit,$10.03,0.00,0.00%,0.00,Malaysia,2021,50,,
KACLW,Kairous Acquisition Corp. Limited Warrants,$0.10,0.02,25.00%,0.00,Malaysia,2022,225,,
KAII,Kismet Acquisition Two Corp. Class A Ordinary Shares,$9.78,-0.04,-0.407%,286065000.00,United States,2021,24165,Finance,Business Services
KAIIU,Kismet Acquisition Two Corp. Unit,$9.81,0.0038,0.039%,0.00,United States,2021,24387,Finance,Business Services
KAIIW,Kismet Acquisition Two Corp. Warrant,$0.08,0.02,33.333%,0.00,United States,2021,4487,Finance,Business Services
KAIR,Kairos Acquisition Corp. Class A Ordinary Shares,$9.83,-0.01,-0.102%,339135000.00,United States,2021,14675,Finance,Business Services
KAIRW,Kairos Acquisition Corp. Warrant,$0.03,-0.0244,-44.853%,0.00,United States,2021,4672,Finance,Business Services
KAL,Kalera Public Limited Company Ordinary Shares,$5.90,-2.76,-31.871%,0.00,Ireland,,293858,,
KALA,Kala Pharmaceuticals Inc. Common Stock,$0.30,-0.02,-6.25%,16817960.00,United States,2017,1522679,Health Care,Biotechnology: Pharmaceutical Preparations
KALU,Kaiser Aluminum Corporation Common Stock,$79.09,0.20,0.254%,1257872748.00,United States,,97281,Industrials,Aluminum
KALV,KalVista Pharmaceuticals Inc. Common Stock,$9.84,0.16,1.653%,241505639.00,United Kingdom,2015,99939,Health Care,Biotechnology: Pharmaceutical Preparations
KALWW,Kalera Public Limited Company Warrant,$0.23,-0.07,-23.333%,0.00,Ireland,,55953,,
KARO,Karooooo Ltd. Ordinary Shares,$21.50,-0.50,-2.273%,665448779.00,Singapore,2021,885,Technology,Computer Software: Prepackaged Software
KAVL,Kaival Brands Innovations Group Inc. Common Stock,$1.58,-0.04,-2.469%,49242422.00,United States,,98651,Consumer Discretionary,Farming/Seeds/Milling
KBAL,Kimball International Inc. Class B Common Stock,$7.67,0.05,0.656%,282378014.00,United States,,153556,Consumer Discretionary,Industrial Specialties
KBNT,Kubient Inc. Common Stock,$0.66,-0.0642,-8.865%,9440470.00,United States,2020,15485,Technology,EDP Services
KBNTW,Kubient Inc. Warrant,$0.2599,0.0412,18.839%,0.00,United States,2020,101,Technology,EDP Services
KC,Kingsoft Cloud Holdings Limited American Depositary Shares,$4.45,-0.03,-0.67%,1083776603.00,China,2020,2107307,Technology,Computer Software: Prepackaged Software
KDNY,Chinook Therapeutics Inc. Common Stock,$17.49,-0.52,-2.887%,1077485862.00,United States,2015,1044432,Health Care,Biotechnology: Pharmaceutical Preparations
KDP,Keurig Dr Pepper Inc. Common Stock,$35.39,-0.1025,-0.289%,50202372384.00,United States,,7680498,Consumer Staples,Beverages (Production/Distribution)
KE,Kimball Electronics Inc. Common Stock,$20.10,0.10,0.50%,499488116.00,United States,,67616,Technology,Industrial Machinery/Components
KELYA,Kelly Services Inc. Class A Common Stock,$19.83,0.52,2.693%,751906960.00,United States,,183778,Consumer Discretionary,Diversified Commercial Services
KELYB,Kelly Services Inc. Class B Common Stock,$19.03,0.00,0.00%,721572841.00,United States,,21,Consumer Discretionary,Diversified Commercial Services
KEQU,Kewaunee Scientific Corporation Common Stock,$16.62,2.62,18.714%,46367689.00,United States,,18258,Industrials,Medical Specialities
KERN,Akerna Corp. Common Stock,$0.1382,-0.1555,-52.945%,1942913.00,United States,2018,69797318,Health Care,Managed Health Care
KERNW,Akerna Corp Warrant,$0.05,-0.005,-9.091%,0.00,United States,2018,47527,Health Care,Managed Health Care
KFFB,Kentucky First Federal Bancorp Common Stock,$7.97,0.5599,7.556%,65493690.00,United States,2005,3062,Finance,Savings Institutions
KFRC,Kforce Inc. Common Stock,$61.34,0.50,0.822%,1311722163.00,United States,1995,201175,Consumer Discretionary,Diversified Commercial Services
KHC,The Kraft Heinz Company Common Stock,$38.14,0.16,0.421%,46685062226.00,United States,,7169347,Consumer Staples,Farming/Seeds/Milling
KIDS,OrthoPediatrics Corp. Common Stock,$43.15,-0.81,-1.843%,872920228.00,United States,2017,103078,Health Care,Medical/Dental Instruments
KIII,Kismet Acquisition Three Corp. Class A Ordinary Shares,$9.79,0.00,0.00%,356723125.00,United States,2021,2,Finance,Business Services
KIIIU,Kismet Acquisition Three Corp. Unit,$9.76,-0.0272,-0.278%,0.00,United States,2021,401,Finance,Business Services
KIIIW,Kismet Acquisition Three Corp. Warrant,$0.04,-0.005,-11.111%,0.00,United States,2021,805,Finance,Business Services
KINS,Kingstone Companies Inc. Common Stock,$3.94,-0.01,-0.253%,41941686.00,United States,,4274,Finance,Specialty Insurers
KINZ,KINS Technology Group Inc. Class A Common Stock,$10.00,0.0392,0.394%,345000000.00,United States,2021,800,Industrials,Consumer Electronics/Appliances
KINZU,KINS Technology Group Inc. Unit,$10.10,0.01,0.099%,0.00,United States,2020,3365,Industrials,Consumer Electronics/Appliances
KINZW,KINS Technology Group Inc. Warrant,$0.11,0.00,0.00%,0.00,United States,2021,27341,Industrials,Consumer Electronics/Appliances
KIRK,Kirkland's Inc. COMMONSTOCK,$3.52,-0.24,-6.383%,44801205.00,United States,2002,527743,Miscellaneous,Diversified Commercial Services
KLAC,KLA Corporation Common Stock,$319.08,-1.49,-0.465%,45528264515.00,United States,1980,1302305,Technology,Electronic Components
KLAQ,KL Acquisition Corp Class A Common Stock,$9.84,0.015,0.153%,353625000.00,United States,2021,1787,Industrials,Consumer Electronics/Appliances
KLAQU,KL Acquisition Corp Unit,$9.81,-0.05,-0.507%,0.00,United States,2021,285,Industrials,Consumer Electronics/Appliances
KLIC,Kulicke and Soffa Industries Inc. Common Stock,$42.81,-0.50,-1.154%,2531360394.00,Singapore,,556005,Technology,Semiconductors
KLTR,Kaltura Inc. Common Stock,$1.99,-0.01,-0.50%,254107408.00,United States,2021,213257,Technology,EDP Services
KLXE,KLX Energy Services Holdings Inc. Common Stock,$4.33,-0.27,-5.87%,50615033.00,United States,,181093,Energy,Oilfield Services/Equipment
KMDA,Kamada Ltd. Ordinary Shares,$4.51,-0.05,-1.096%,202050273.00,Israel,2013,3291,Health Care,Biotechnology: Pharmaceutical Preparations
KMPH,KemPharm Inc. Common Stock,$4.46,-0.20,-4.292%,153528797.00,United States,,207807,Health Care,Biotechnology: Pharmaceutical Preparations
KNBE,KnowBe4 Inc. Class A Common Stock,$15.62,-1.07,-6.411%,2734659941.00,United States,2021,946247,Technology,Computer Software: Prepackaged Software
KNDI,Kandi Technologies Group Inc Common Stock,$2.40,-0.05,-2.041%,181691628.00,China,,254491,Consumer Discretionary,Auto Parts:O.E.M.
KNSA,Kiniksa Pharmaceuticals Ltd. Class A Common Stock,$9.69,-0.19,-1.923%,671281766.00,United States,2018,112937,Health Care,Biotechnology: Pharmaceutical Preparations
KNTE,Kinnate Biopharma Inc. Common Stock,$12.61,-0.01,-0.079%,554557826.00,United States,2020,164228,Health Care,Biotechnology: Pharmaceutical Preparations
KNTK,Kinetik Holdings Inc. Class A Common Stock,$34.14,-0.26,-0.756%,4608741044.00,United States,2017,358678,Energy,Oil & Gas Production
KOD,Kodiak Sciences Inc Common Stock,$7.64,-0.28,-3.535%,396925741.00,United States,2018,445748,Health Care,Biotechnology: Pharmaceutical Preparations
KOPN,Kopin Corporation Common Stock,$1.12,-0.06,-5.085%,102944041.00,United States,1992,833117,Technology,Industrial Machinery/Components
KOSS,Koss Corporation Common Stock,$6.95,0.10,1.46%,63577175.00,United States,,25494,Consumer Staples,Consumer Electronics/Appliances
KPLT,Katapult Holdings Inc. Common Stock,$1.07,-0.03,-2.727%,104994833.00,United States,2019,1603096,Technology,EDP Services
KPLTW,Katapult Holdings Inc. Warrant,$0.1498,-0.0001,-0.067%,0.00,United States,2019,4852,Technology,EDP Services
KPRX,Kiora Pharmaceuticals Inc.  Common Stock,$0.4706,0.0529,12.665%,5959662.00,United States,,417905,Health Care,Biotechnology: In Vitro & In Vivo Diagnostic Substances
KPTI,Karyopharm Therapeutics Inc. Common Stock,$4.51,0.00,0.00%,358176754.00,United States,2013,1827033,Miscellaneous,Diversified Commercial Services
KRBP,Kiromic BioPharma Inc. Common Stock,$0.4251,-0.0249,-5.533%,6661036.00,United States,2020,53357,Consumer Discretionary,Specialty Chemicals
KRKR,36Kr Holdings Inc. American Depositary Shares,$1.04,-0.01,-0.952%,42241189.00,China,2019,59947,Consumer Discretionary,Business Services
KRMD,Repro Med Systems Inc. Common Stock,$2.53,0.11,4.545%,113517571.00,United States,,3348,Health Care,Medical/Dental Instruments
KRNL,Kernel Group Holdings Inc. Class A Ordinary Shares,$9.82,-0.02,-0.203%,374080625.00,United States,2021,7461,Finance,Business Services
KRNLU,Kernel Group Holdings Inc. Units,$9.85,0.00,0.00%,0.00,United States,2021,2,Finance,Business Services
KRNLW,Kernel Group Holdings Inc. Warrants,$0.075,-0.0262,-25.889%,0.00,United States,2021,2138,Finance,Business Services
KRNT,Kornit Digital Ltd. Ordinary Shares,$31.70,-0.71,-2.191%,1575000362.00,Israel,2015,727647,Industrials,Industrial Machinery/Components
KRNY,Kearny Financial Corp Common Stock,$11.11,-0.03,-0.269%,753393553.00,United States,2005,165054,Finance,Savings Institutions
KRON,Kronos Bio Inc. Common Stock,$3.64,-0.10,-2.674%,206505212.00,United States,2020,325916,Consumer Discretionary,Specialty Chemicals
KROS,Keros Therapeutics Inc. Common Stock,$27.63,0.45,1.656%,664084950.00,United States,2020,250559,Consumer Discretionary,Specialty Chemicals
KRT,Karat Packaging Inc. Common Stock,$17.06,-0.12,-0.698%,337948773.00,United States,2021,8858,Industrials,Office Equipment/Supplies/Services
KRTX,Karuna Therapeutics Inc. Common Stock,$126.51,1.53,1.224%,3780463793.00,United States,2019,410536,Health Care,Biotechnology: Pharmaceutical Preparations
KRUS,Kura Sushi USA Inc. Class A Common Stock,$49.53,1.95,4.098%,481405399.00,United States,2019,77697,Consumer Discretionary,Restaurants
KRYS,Krystal Biotech Inc. Common Stock,$65.66,1.00,1.547%,1683203161.00,United States,2017,176124,Health Care,Biotechnology: Biological Products (No Diagnostic Substances)
KSCP,Knightscope Inc. Class A Common Stock,$3.00,0.00,0.00%,108687591.00,United States,2022,128719,Technology,Security Systems Services
KSI,Kadem Sustainable Impact Corporation Class A common stock,$9.75,0.00,0.00%,213281250.00,United States,2021,15,Industrials,Consumer Electronics/Appliances
KSICU,Kadem Sustainable Impact Corporation Unit,$9.78,0.00,0.00%,0.00,United States,2021,10830,Industrials,Consumer Electronics/Appliances
KSICW,Kadem Sustainable Impact Corporation Warrant,$0.1048,0.0055,5.539%,0.00,United States,2021,225,Industrials,Consumer Electronics/Appliances
KSPN,Kaspien Holdings Inc. Common Stock,$2.47,-0.15,-5.725%,6178873.00,United States,,18655,Technology,Retail: Computer Software & Peripheral Equipment
KTCC,Key Tronic Corporation Common Stock,$4.41,-0.06,-1.342%,47459851.00,United States,1983,7647,Technology,Computer peripheral equipment
KTOS,Kratos Defense & Security Solutions Inc. Common Stock,$13.88,0.15,1.092%,1734971130.00,United States,,566377,Consumer Discretionary,Ordnance And Accessories
KTRA,Kintara Therapeutics Inc. Common Stock,$0.278,-0.017,-5.763%,18218126.00,United States,,1556400,Health Care,Biotechnology: Pharmaceutical Preparations
KTTA,Pasithea Therapeutics Corp. Common Stock,$1.01,-0.0099,-0.971%,23520696.00,United States,2021,59914,Health Care,Biotechnology: Pharmaceutical Preparations
KTTAW,Pasithea Therapeutics Corp. Warrant,$0.0648,-0.0003,-0.461%,0.00,United States,2021,12487,Health Care,Biotechnology: Pharmaceutical Preparations
KURA,Kura Oncology Inc. Common Stock,$18.33,0.11,0.604%,1221439805.00,United States,,486443,Health Care,Biotechnology: Biological Products (No Diagnostic Substances)
KVHI,KVH Industries Inc. Common Stock,$8.70,0.06,0.694%,164379949.00,United States,1996,44734,Technology,Radio And Television Broadcasting And Communications Equipment
KVSA,Khosla Ventures Acquisition Co. Class A Common Stock,$9.75,-0.02,-0.205%,394777500.00,United States,2021,275304,Industrials,Consumer Electronics/Appliances
KVSC,Khosla Ventures Acquisition Co. III Class A Common Stock,$9.73,-0.01,-0.103%,610623907.00,United States,2021,191311,Industrials,Consumer Electronics/Appliances
KXIN,Kaixin Auto Holdings Ordinary Shares,$1.02,0.01,0.99%,178356837.00,China,2017,732957,Finance,Business Services
KYCH,Keyarch Acquisition Corporation Ordinary Shares,$9.82,0.00,0.00%,148478400.00,United States,2022,8,,
KYCHR,Keyarch Acquisition Corporation Rights,$0.17,0.0001,0.059%,0.00,United States,2022,30000,,
KYCHU,Keyarch Acquisition Corporation Unit,$10.00,0.00,0.00%,0.00,United States,2022,450,,
KYCHW,Keyarch Acquisition Corporation Warrant,$0.08,-0.02,-20.00%,0.00,United States,2022,4601,,
KYMR,Kymera Therapeutics Inc. Common Stock,$19.69,-0.60,-2.957%,1018449085.00,United States,2020,631961,Consumer Discretionary,Specialty Chemicals
KZIA,Kazia Therapeutics Limited American Depositary Shares,$4.20,0.10,2.439%,58277255.00,Australia,,74510,Health Care,Biotechnology: Pharmaceutical Preparations
KZR,Kezar Life Sciences Inc. Common Stock,$8.27,0.34,4.288%,499636896.00,United States,2018,4427638,Health Care,Biotechnology: Pharmaceutical Preparations
LAAA,Lakeshore Acquisition I Corp. Ordinary Shares,$10.14,0.00,0.00%,71947610.00,China,2021,100,,
LAAAW,Lakeshore Acquisition I Corp. Warrant,$0.25,0.0703,39.121%,0.00,China,2021,100,,
LAB,Standard BioTools Inc. Common Stock,$1.60,-0.01,-0.621%,123603416.00,United States,2011,681975,Industrials,Biotechnology: Laboratory Analytical Instruments
LABP,Landos Biopharma Inc. Common Stock,$0.7279,0.0099,1.379%,29301534.00,United States,2021,57196,Consumer Discretionary,Specialty Chemicals
LAKE,Lakeland Industries Inc. Common Stock,$15.36,0.32,2.128%,117820969.00,United States,1986,38512,,
LAMR,Lamar Advertising Company Class A Common Stock,$87.97,-0.32,-0.362%,8927380513.00,United States,1996,575289,Real Estate,Real Estate Investment Trusts
LANC,Lancaster Colony Corporation Common Stock,$128.78,-1.39,-1.068%,3544283160.00,United States,,213083,Consumer Staples,Packaged Foods
LAND,Gladstone Land Corporation Common Stock,$22.16,-0.35,-1.555%,758093888.00,United States,2013,410664,Real Estate,Real Estate Investment Trusts
LANDM,Gladstone Land Corporation 5.00% Series D Cumulative Term Preferred Stock,$24.90,0.05,0.201%,600149909.00,United States,,8993,Real Estate,Real Estate Investment Trusts
LANDO,Gladstone Land Corporation 6.00% Series B Cumulative Redeemable Preferred Stock,$26.30,-0.13,-0.492%,0.00,United States,,17098,Real Estate,Real Estate Investment Trusts
LARK,Landmark Bancorp Inc. Common Stock,$25.34,0.29,1.158%,126423237.00,United States,,1103,Finance,Major Banks
LASR,nLIGHT Inc. Common Stock,$10.22,-0.02,-0.195%,455313162.00,United States,2018,209397,Technology,Semiconductors
LATG,LatAmGrowth SPAC Class A Ordinary Shares,$10.005,0.00,0.00%,162581250.00,Mexico,2022,1,,
LATGW,LatAmGrowth SPAC Warrants,$0.12,0.00,0.00%,0.00,Mexico,2022,9500,,
LAUR,Laureate Education Inc. Common Stock,$11.57,0.32,2.844%,1995882630.00,United States,2017,1288709,Consumer Discretionary,Service to the Health Industry
LAX,8i Acquisition 2 Corp. Ordinary Shares,$9.87,0.00,0.00%,109295445.00,Singapore,2021,2169,,
LAXXU,8i Acquisition 2 Corp. Unit,$10.20,0.00,0.00%,0.00,Singapore,2021,10,,
LAZR,Luminar Technologies Inc.  Class A Common Stock,$5.93,-0.27,-4.355%,2114136601.00,United States,2019,9896678,Consumer Discretionary,Auto Parts:O.E.M.
LAZY,Lazydays Holdings Inc. Common Stock,$11.78,0.19,1.639%,139580301.00,United States,,231548,Consumer Discretionary,Other Specialty Stores
LBAI,Lakeland Bancorp Inc. Common Stock,$14.62,-0.08,-0.544%,947077869.00,United States,,163664,Finance,Major Banks
LBBB,Lakeshore Acquisition II Corp. Ordinary Shares,$9.91,0.02,0.202%,90592265.00,United States,2022,8428,,
LBBBR,Lakeshore Acquisition II Corp. Rights,$0.11,-0.09,-45.00%,0.00,United States,2022,1902,,
LBBBU,Lakeshore Acquisition II Corp. Unit,$10.05,-0.03,-0.298%,0.00,United States,2022,108364,,
LBBBW,Lakeshore Acquisition II Corp. Warrants,$0.0775,-0.005,-6.061%,0.00,United States,2022,1950,,
LBC,Luther Burbank Corporation Common Stock,$13.05,-0.07,-0.534%,667186601.00,United States,2003,28025,Finance,Commercial Banks
LBPH,Longboard Pharmaceuticals Inc. Common Stock,$3.09,-0.02,-0.643%,53195432.00,United States,2021,11177,Health Care,Biotechnology: Pharmaceutical Preparations
LBPSW,4D pharma plc Warrant,$0.0442,-0.0153,-25.714%,0.00,United Kingdom,,100,Health Care,Biotechnology: Pharmaceutical Preparations
LBRDA,Liberty Broadband Corporation Class A Common Stock,$113.55,0.92,0.817%,18483031417.00,United States,,505233,Consumer Discretionary,Telecommunications Equipment
LBRDK,Liberty Broadband Corporation Class C Common Stock,$115.64,0.93,0.811%,18823229881.00,United States,,906879,Consumer Discretionary,Telecommunications Equipment
LBRDP,Liberty Broadband Corporation Series A Cumulative Redeemable Preferred Stock,$25.92,-0.055,-0.212%,0.00,United States,,1050,Consumer Discretionary,Telecommunications Equipment
LBTYA,Liberty Global plc Class A Ordinary Shares,$21.05,-1.23,-5.521%,10626404691.00,United Kingdom,,1608129,Telecommunications,Cable & Other Pay Television Services
LBTYB,Liberty Global plc Class B Ordinary Shares,$22.40,0.00,0.00%,11307908080.00,United Kingdom,,6,Telecommunications,Cable & Other Pay Television Services
LBTYK,Liberty Global plc Class C Ordinary Shares,$22.09,-1.17,-5.03%,11151414709.00,United Kingdom,,5382401,Telecommunications,Cable & Other Pay Television Services
LCA,Landcadia Holdings IV Inc. Class A Common Stock,$9.79,-0.02,-0.204%,611875000.00,United States,2021,170922,Industrials,Consumer Electronics/Appliances
LCAA,L Catterton Asia Acquisition Corp Class A Ordinary Shares,$9.84,0.00,0.00%,352405745.00,Singapore,2021,144,Finance,Business Services
LCAAU,L Catterton Asia Acquisition Corp Units,$9.82,0.00,0.00%,0.00,Singapore,2021,100,Finance,Business Services
LCAAW,L Catterton Asia Acquisition Corp Warrant,$0.10,0.00,0.00%,0.00,Singapore,2021,33,Finance,Business Services
LCAHU,Landcadia Holdings IV Inc. Units,$9.79,-0.10,-1.011%,0.00,United States,2021,58706,Industrials,Consumer Electronics/Appliances
LCAHW,Landcadia Holdings IV Inc. Warrant ,$0.32,-0.0347,-9.783%,0.00,United States,2021,1159,Industrials,Consumer Electronics/Appliances
LCFY,Locafy Limited Ordinary Share,$0.5748,-0.0132,-2.245%,11799956.00,Australia,2022,13725,,
LCID,Lucid Group Inc. Common Stock,$17.16,-0.14,-0.809%,28620144233.00,United States,,13175577,Consumer Discretionary,Auto Manufacturing
LCNB,LCNB Corporation Common Stock,$14.95,-0.05,-0.333%,170455071.00,United States,,10163,Finance,Major Banks
LCUT,Lifetime Brands Inc. Common Stock,$11.04,0.07,0.638%,244682700.00,United States,1991,55842,Consumer Discretionary,Home Furnishings
LDHA,LDH Growth Corp I Class A Ordinary Shares,$9.77,-0.07,-0.711%,280887500.00,United States,2021,2930,Finance,Business Services
LDHAU,LDH Growth Corp I Units,$9.80,-0.02,-0.204%,0.00,United States,2021,9617,Finance,Business Services
LE,Lands' End Inc. Common Stock,$10.62,-0.72,-6.349%,354856372.00,United States,,775288,Consumer Discretionary,Clothing/Shoe/Accessory Stores
LECO,Lincoln Electric Holdings Inc. Common Shares,$123.36,0.59,0.481%,7231946199.00,United States,,315073,Industrials,Industrial Machinery/Components
LEDS,SemiLEDS Corporation Common Stock,$2.51,-0.02,-0.791%,11329871.00,Taiwan,2010,9169,Technology,Semiconductors
LEE,Lee Enterprises Incorporated Common Stock,$18.99,0.19,1.011%,113133609.00,United States,,11448,Consumer Discretionary,Newspapers/Magazines
LEGA,Lead Edge Growth Opportunities Ltd Class A Ordinary Shares,$9.79,0.00,0.00%,422193750.00,United States,2021,161106,Finance,Business Services
LEGAU,Lead Edge Growth Opportunities Ltd Units,$9.82,0.00,0.00%,0.00,United States,2021,133,Finance,Business Services
LEGAW,Lead Edge Growth Opportunities Ltd Warrant,$0.2001,0.0001,0.05%,0.00,United States,2021,20389,Finance,Business Services
