Symbol,Name,Last Sale,Net Change,% Change,Market Cap,Country,IPO Year,Volume,Sector,Industry
CRESY,Cresud S.A.C.I.F. y A. American Depositary Shares,$5.04,-0.06,-1.176%,298412720.00,Argentina,1997,124563,Finance,Real Estate
CREX,Creative Realities Inc. Common Stock,$0.6115,-0.0085,-1.371%,13287296.00,United States,,42932,Technology,EDP Services
CREXW,Creative Realities Inc. Warrant,$0.0999,0.00,0.00%,0.00,United States,,50,Technology,EDP Services
CRGE,Charge Enterprises Inc. Common Stock,$4.77,0.19,4.148%,712776206.00,United States,,1262689,Technology,EDP Services
CRIS,Curis Inc. Common Stock,$0.9845,-0.0155,-1.55%,90224866.00,United States,,2312182,Health Care,Biotechnology: Biological Products (No Diagnostic Substances)
CRKN,Crown Electrokinetics Corp. Common Stock,$0.9102,-0.0249,-2.663%,13274674.00,United States,,5535,,
CRMD,CorMedix Inc. Common Stock,$4.02,0.43,11.978%,157275501.00,United States,,565100,Health Care,Biotechnology: Pharmaceutical Preparations
CRMT,America's Car-Mart Inc Common Stock,$100.60,-1.32,-1.295%,641020886.00,United States,,86807,Consumer Discretionary,Other Specialty Stores
CRNC,Cerence Inc. Common Stock,$25.23,-0.99,-3.776%,991674662.00,United States,,675437,Technology,EDP Services
CRNT,Ceragon Networks Ltd. Ordinary Shares,$2.57,0.00,0.00%,215884282.00,Israel,,1018606,Technology,Radio And Television Broadcasting And Communications Equipment
CRNX,Crinetics Pharmaceuticals Inc. Common Stock,$18.65,0.65,3.611%,997883338.00,United States,2018,186753,Health Care,Biotechnology: Pharmaceutical Preparations
CRON,Cronos Group Inc. Common Share,$2.82,-0.06,-2.083%,1059133262.00,Canada,,1524806,,
CROX,Crocs Inc. Common Stock,$48.67,0.14,0.288%,2996865714.00,United States,2006,1618789,Consumer Discretionary,Shoe Manufacturing
CRSP,CRISPR Therapeutics AG Common Shares,$60.77,-2.23,-3.54%,4707066812.00,Switzerland,2016,1376645,Health Care,Biotechnology: Biological Products (No Diagnostic Substances)
CRSR,Corsair Gaming Inc. Common Stock,$13.13,-0.39,-2.885%,1252600805.00,United States,2020,691383,Technology,Computer Manufacturing
CRTD,Creatd Inc. Common Stock,$0.7389,-0.0111,-1.48%,14881751.00,United States,,111864,Consumer Discretionary,Publishing
CRTDW,Creatd Inc. Warrant,$0.19,-0.049,-20.502%,0.00,United States,,32536,Consumer Discretionary,Publishing
CRTO,Criteo S.A. American Depositary Shares,$24.40,0.35,1.455%,1472669418.00,France,2013,276050,Consumer Discretionary,Advertising
CRTX,Cortexyme Inc. Common Stock,$2.22,-0.04,-1.77%,80254854.00,United States,2019,224957,Health Care,Biotechnology: Biological Products (No Diagnostic Substances)
CRUS,Cirrus Logic Inc. Common Stock,$72.54,-0.01,-0.014%,4054407348.00,United States,1989,392418,Technology,Semiconductors
CRVL,CorVel Corp. Common Stock,$147.27,0.35,0.238%,2584223123.00,United States,,40951,Finance,Specialty Insurers
CRVS,Corvus Pharmaceuticals Inc. Common Stock,$0.9901,-0.0299,-2.931%,46092631.00,United States,2016,340040,Health Care,Biotechnology: Pharmaceutical Preparations
CRWD,CrowdStrike Holdings Inc. Class A Common Stock,$168.56,-7.38,-4.195%,39117999852.00,United States,2019,4206837,Technology,EDP Services
CRWS,Crown Crafts Inc Common Stock,$6.26,0.0455,0.732%,63078865.00,United States,,4472,,
CRXT,Clarus Therapeutics Holdings Inc. Common Stock,$0.3821,0.0021,0.553%,19877121.00,United States,2021,5300615,Health Care,Biotechnology: Pharmaceutical Preparations
CRXTW,Clarus Therapeutics Holdings Inc. Warrants,$0.08,0.0149,22.888%,0.00,United States,2021,6014,Health Care,Biotechnology: Pharmaceutical Preparations
CRZN,Corazon Capital V838 Monoceros Corp Class A Ordinary Shares,$9.78,-0.02,-0.204%,249144278.00,United States,2021,321150,Finance,Business Services
CSBR,Champions Oncology Inc. Common Stock,$8.0001,0.1501,1.912%,108180880.00,United States,,5214,Health Care,Biotechnology: Biological Products (No Diagnostic Substances)
CSCO,Cisco Systems Inc. Common Stock (DE),$42.64,-0.24,-0.56%,176570706538.00,United States,1990,24940917,Telecommunications,Computer Communications Equipment
CSCW,Color Star Technology Co. Ltd. Ordinary Shares,$0.1325,0.0012,0.914%,24802348.00,United States,,106578375,Consumer Discretionary,Engineering & Construction
CSGP,CoStar Group Inc. Common Stock,$60.41,0.20,0.332%,23935969890.00,United States,1998,2235835,Finance,Real Estate
CSGS,CSG Systems International Inc. Common Stock,$59.68,0.22,0.37%,1935896140.00,United States,1996,158723,Technology,EDP Services
CSII,Cardiovascular Systems Inc. Common Stock,$14.36,-0.29,-1.98%,585674366.00,United States,1981,292941,Health Care,Medical/Dental Instruments
CSIQ,Canadian Solar Inc. Common Shares (BC),$31.14,1.05,3.49%,2001331086.00,Canada,2006,565762,,
CSLM,Consilium Acquisition Corp I Ltd. Class A Ordinary Share,$9.78,-0.02,-0.204%,231969375.00,United States,2022,14471,,
CSLMR,Consilium Acquisition Corp I Ltd. Right,$0.10,-0.05,-33.333%,0.00,United States,2022,24320,,
CSLMU,Consilium Acquisition Corp I Ltd. Unit,$9.93,-0.03,-0.301%,0.00,United States,2022,41798,,
CSLMW,Consilium Acquisition Corp I Ltd. Warrant,$0.085,0.0171,25.184%,0.00,United States,2022,10142,,
CSPI,CSP Inc. Common Stock,$9.10,0.20,2.247%,41251820.00,United States,1982,2204,Technology,EDP Services
CSQ,Calamos Strategic Total Return Common Stock,$13.11,-0.16,-1.206%,2069740529.00,United States,2004,251767,Finance,Finance Companies
CSSE,Chicken Soup for the Soul Entertainment Inc. Class A Common Stock,$7.41,0.23,3.203%,93728334.00,United States,2017,59716,Consumer Discretionary,Movies/Entertainment
CSSEN,Chicken Soup for the Soul Entertainment Inc. 9.50% Notes due 2025,$23.97,0.01,0.042%,0.00,United States,,3586,Consumer Discretionary,Movies/Entertainment
CSSEP,Chicken Soup for the Soul Entertainment Inc. 9.75% Series A Cumulative Redeemable Perpetual Preferred Stock,$22.4999,0.367,1.658%,0.00,United States,,667,Consumer Discretionary,Movies/Entertainment
CSTE,Caesarstone Ltd. Ordinary Shares,$9.13,0.15,1.67%,314765834.00,Israel,2012,62748,Consumer Discretionary,Multi-Sector Companies
CSTL,Castle Biosciences Inc. Common Stock,$21.95,-1.06,-4.607%,576427106.00,United States,2019,188763,Health Care,Medical Specialities
CSTR,CapStar Financial Holdings Inc. Common Stock,$19.62,0.07,0.358%,432936352.00,United States,2016,74984,Finance,Major Banks
CSWC,Capital Southwest Corporation Common Stock,$18.42,-0.12,-0.647%,471450966.00,United States,,403813,Finance,Finance/Investors Services
CSWI,CSW Industrials Inc. Common Stock,$103.03,1.83,1.808%,1615179674.00,United States,,51357,Industrials,Home Furnishings
CSX,CSX Corporation Common Stock,$29.06,-0.06,-0.206%,63183994205.00,United States,,16745223,Industrials,Railroads
CTAQ,Carney Technology Acquisition Corp. II Class A Common Stock,$9.85,0.00,0.00%,504443125.00,United States,2021,87152,Industrials,Consumer Electronics/Appliances
CTAQU,Carney Technology Acquisition Corp. II Units,$9.84,0.00,0.00%,0.00,United States,2020,4,Industrials,Consumer Electronics/Appliances
CTAQW,Carney Technology Acquisition Corp. II Warrant,$0.16,0.00,0.00%,0.00,United States,2021,12020,Industrials,Consumer Electronics/Appliances
CTAS,Cintas Corporation Common Stock,$373.53,1.08,0.29%,38221424006.00,United States,1983,368266,Consumer Discretionary,Business Services
CTBI,Community Trust Bancorp Inc. Common Stock,$40.44,-0.14,-0.345%,723681120.00,United States,,37308,Finance,Major Banks
CTG,Computer Task Group Inc. Common Stock,$8.56,-0.13,-1.496%,131971266.00,United States,,15970,Technology,EDP Services
CTHR,Charles & Colvard Ltd Common Stock,$1.22,-0.0499,-3.929%,37440331.00,United States,1997,28279,Consumer Discretionary,Consumer Specialties
CTIB,Yunhong CTI Ltd. Common Stock,$0.7147,-0.0252,-3.406%,4225128.00,United States,1997,25356,Miscellaneous,Diversified Commercial Services
CTIC,CTI BioPharma Corp. (DE) Common Stock,$5.97,0.50,9.141%,650532303.00,United States,1997,6501326,Health Care,Biotechnology: Pharmaceutical Preparations
CTKB,Cytek Biosciences Inc. Common Stock,$10.73,-0.14,-1.288%,1441179939.00,United States,2021,563925,Health Care,Biotechnology: Electromedical & Electrotherapeutic Apparatus
CTLP,Cantaloupe Inc. Common Stock,$5.60,0.21,3.896%,398221645.00,United States,,439744,Technology,EDP Services
CTMX,CytomX Therapeutics Inc. Common Stock,$1.83,-0.04,-2.139%,119678990.00,United States,2015,554355,Health Care,Biotechnology: Pharmaceutical Preparations
CTRM,Castor Maritime Inc. Common Shares,$1.34,-0.06,-4.286%,126777518.00,Cyprus,,627688,Consumer Discretionary,Marine Transportation
CTRN,Citi Trends Inc. Common Stock,$23.65,-0.29,-1.211%,198551257.00,United States,2005,366270,,
CTSH,Cognizant Technology Solutions Corporation Class A Common Stock,$67.49,-0.99,-1.446%,35174022327.00,United States,1998,2668306,Technology,EDP Services
CTSO,Cytosorbents Corporation Common Stock,$2.19,-0.06,-2.667%,95401041.00,United States,,129330,Health Care,Medical/Dental Instruments
CTXR,Citius Pharmaceuticals Inc. Common Stock,$0.92,-0.0256,-2.707%,134439260.00,United States,,438794,Health Care,Biotechnology: Pharmaceutical Preparations
CTXRW,Citius Pharmaceuticals Inc. Warrant,$0.135,0.00,0.00%,0.00,United States,,72,Health Care,Biotechnology: Pharmaceutical Preparations
CTXS,Citrix Systems Inc. Common Stock,$97.17,0.33,0.341%,12299771409.00,United States,1995,1037520,Technology,Computer Software: Prepackaged Software
CUBA,Herzfeld Caribbean Basin Fund Inc. (The) Common Stock,$4.01,-0.11,-2.67%,23961583.00,United States,,12090,Finance,Investment Managers
CUE,Cue Biopharma Inc. Common Stock,$2.49,-0.35,-12.324%,88076763.00,United States,2018,561891,Health Care,Biotechnology: Pharmaceutical Preparations
CUEN,Cuentas Inc. Common Stock,$0.6263,-0.0111,-1.741%,9373012.00,United States,,9148,Technology,Computer Software: Prepackaged Software
CULL,Cullman Bancorp Inc. Common Stock,$11.31,0.31,2.818%,83760650.00,United States,2021,1134,Finance,Savings Institutions
CURI,CuriosityStream Inc. Class A Common Stock,$1.69,-0.08,-4.52%,89186233.00,United States,2020,141755,Industrials,Broadcasting
CURIW,CuriosityStream Inc. Warrant,$0.3109,0.00,0.00%,0.00,United States,2020,20,Industrials,Broadcasting
CUTR,Cutera Inc. Common Stock,$37.50,-2.66,-6.624%,681127088.00,United States,2004,878849,Health Care,Biotechnology: Electromedical & Electrotherapeutic Apparatus
CVAC,CureVac N.V. Ordinary Shares,$13.61,-0.26,-1.875%,2546712972.00,Germany,2020,537987,Health Care,Biotechnology: Pharmaceutical Preparations
CVBF,CVB Financial Corporation Common Stock,$24.81,0.01,0.04%,3499624939.00,United States,,807469,Finance,Major Banks
CVCO,Cavco Industries Inc. Common Stock When Issued,$195.99,-0.93,-0.472%,1742980620.00,United States,,58241,Consumer Discretionary,Homebuilding
CVCY,Central Valley Community Bancorp Common Stock,$14.50,-0.11,-0.753%,169048758.00,United States,,16759,Finance,Major Banks
CVET,Covetrus Inc. Common Stock,$20.75,0.02,0.096%,2895007547.00,United States,,1345212,Health Care,Other Pharmaceuticals
CVGI,Commercial Vehicle Group Inc. Common Stock,$5.84,-0.26,-4.262%,192404564.00,United States,2004,383826,Consumer Discretionary,Auto Parts:O.E.M.
CVGW,Calavo Growers Inc. Common Stock,$41.72,0.47,1.139%,740202081.00,United States,,93804,Consumer Discretionary,Specialty Foods
CVLG,Covenant Logistics Group Inc. Class A Common Stock,$25.09,0.25,1.006%,391349755.00,United States,,201905,Industrials,Trucking Freight/Courier Services
CVLT,Commvault Systems Inc. Common Stock,$62.90,-1.08,-1.688%,2805505490.00,United States,2006,188013,Technology,Computer Software: Prepackaged Software
CVLY,Codorus Valley Bancorp Inc Common Stock,$22.51,0.34,1.534%,214478026.00,United States,,5395,Finance,Savings Institutions
CVRX,CVRx Inc. Common Stock,$6.01,0.01,0.167%,123206064.00,United States,2021,49791,Health Care,Biotechnology: Electromedical & Electrotherapeutic Apparatus
CVT,Cvent Holding Corp. Common Stock,$4.62,0.13,2.895%,2223718525.00,United States,2020,592979,Technology,Computer Software: Prepackaged Software
CVV,CVD Equipment Corporation Common Stock,$3.95,0.155,4.084%,26579305.00,United States,,8464,Technology,Industrial Machinery/Components
CWBC,Community West Bancshares Common Stock,$14.31,0.51,3.696%,124250567.00,United States,,360,Finance,Major Banks
CWBR,CohBar Inc. Common Stock,$0.1897,0.0073,4.002%,16500425.00,United States,,585478,Health Care,Biotechnology: In Vitro & In Vivo Diagnostic Substances
CWCO,Consolidated Water Co. Ltd. Ordinary Shares,$14.50,0.575,4.129%,221640084.00,Cayman Islands,,71974,Utilities,Water Supply
CWST,Casella Waste Systems Inc. Class A Common Stock,$72.68,1.02,1.423%,3753102024.00,United States,1997,316341,Utilities,Environmental Services
CXDO,Crexendo Inc. Common Stock,$3.10,0.14,4.73%,69518142.00,United States,,18331,Consumer Discretionary,Telecommunications Equipment
CYAD,Celyad Oncology SA American Depositary Shares,$1.73,-0.10,-5.464%,39087544.00,Belgium,2015,3600,Health Care,Biotechnology: Pharmaceutical Preparations
CYAN,Cyanotech Corporation Common Stock,$2.92,-0.08,-2.667%,18114638.00,United States,,14741,Consumer Staples,Farming/Seeds/Milling
CYBE,CyberOptics Corporation Common Stock,$34.94,0.01,0.029%,258684684.00,United States,1987,73493,Technology,Electronic Components
CYBR,CyberArk Software Ltd. Ordinary Shares,$127.96,-4.25,-3.215%,5210061459.00,Israel,2014,359234,Technology,Computer Software: Prepackaged Software
CYCC,Cyclacel Pharmaceuticals Inc. Common Stock,$1.08,-0.40,-27.027%,10794588.00,United States,,3294417,Health Care,Biotechnology: Pharmaceutical Preparations
CYCCP,Cyclacel Pharmaceuticals Inc. 6% Convertible Preferred Stock,$6.77,0.00,0.00%,0.00,United States,,42,Health Care,Biotechnology: Pharmaceutical Preparations
CYCN,Cyclerion Therapeutics Inc. Common Stock,$0.5488,-0.0012,-0.218%,23844460.00,United States,,138016,Health Care,Biotechnology: Pharmaceutical Preparations
CYN,Cyngn Inc. Common Stock,$1.15,-0.08,-6.504%,38611634.00,United States,2021,641150,Technology,EDP Services
CYRN,CYREN Ltd. Ordinary Shares,$2.02,-0.09,-4.265%,10773799.00,United States,,305113,Technology,Computer Software: Prepackaged Software
CYRX,CryoPort Inc. Common Stock,$30.98,-0.63,-1.993%,1529681151.00,United States,,488509,,
CYT,Cyteir Therapeutics Inc. Common Stock,$2.99,0.22,7.942%,105872994.00,United States,2021,100284,Health Care,Biotechnology: Pharmaceutical Preparations
CYTH,Cyclo Therapeutics Inc. Common Stock,$1.97,-0.23,-10.455%,16580607.00,United States,,33440,Health Care,Biotechnology: Pharmaceutical Preparations
CYTHW,Cyclo Therapeutics Inc. Warrant,$0.50,-0.20,-28.571%,0.00,United States,,500,Health Care,Biotechnology: Pharmaceutical Preparations
CYTK,Cytokinetics Incorporated Common Stock,$39.29,-9.45,-19.389%,3365275449.00,United States,2004,10394427,Health Care,Biotechnology: Pharmaceutical Preparations
CYTO,Altamira Therapeutics Ltd. Common Shares 0.01 SF (Bermuda),$0.4853,-0.0247,-4.843%,7553336.00,Bermuda,2014,294485,Health Care,Biotechnology: Pharmaceutical Preparations
CYXT,Cyxtera Technologies Inc. Class A Common Stock,$11.34,-0.10,-0.874%,2024942432.00,United States,2020,1109942,Technology,EDP Services
CZFS,Citizens Financial Services Inc. Common Stock,$70.00,0.02,0.029%,278513830.00,United States,,198,Finance,Major Banks
CZNC,Citizens & Northern Corp Common Stock,$24.17,0.21,0.876%,377176113.00,United States,,13286,Finance,Major Banks
CZR,Caesars Entertainment Inc. Common Stock,$38.30,-1.97,-4.892%,8210223124.00,United States,,7419225,Consumer Discretionary,Hotels/Resorts
CZWI,Citizens Community Bancorp Inc. Common Stock,$13.83,0.15,1.096%,145647616.00,United States,2006,2169,Finance,Savings Institutions
DADA,Dada Nexus Limited American Depositary Shares,$8.11,0.02,0.247%,2110846162.00,China,2020,1326581,Consumer Discretionary,Department/Specialty Retail Stores
DAIO,Data I/O Corporation Common Stock,$3.07,0.06,1.993%,26476205.00,United States,1981,2733,Technology,Industrial Machinery/Components
DAKT,Daktronics Inc. Common Stock,$3.01,-0.07,-2.273%,135551855.00,United States,1994,211195,Industrials,Office Equipment/Supplies/Services
DALN,DallasNews Corporation Series A Common Stock,$6.33,0.0657,1.049%,33881262.00,United States,,9753,Consumer Discretionary,Newspapers/Magazines
DALS,DA32 Life Science Tech Acquisition Corp. Class A Common Stock,$9.69,0.00,0.00%,248548500.00,United States,2021,207002,Industrials,Consumer Electronics/Appliances
DAOO,Crypto 1 Acquisition Corp Class A Ordinary Shares,$9.91,-0.02,-0.201%,284912500.00,United States,2022,7808,,
DAOOU,Crypto 1 Acquisition Corp Unit,$9.99,0.00,0.00%,0.00,United States,2021,17062,,
DAOOW,Crypto 1 Acquisition Corp Warrants,$0.1402,-0.0098,-6.533%,0.00,United States,2022,6020,,
DARE,Dare Bioscience Inc. Common Stock,$1.23,-0.02,-1.60%,104194956.00,United States,2014,2711576,Health Care,Biotechnology: Pharmaceutical Preparations
DATS,DatChat Inc. Common Stock,$1.09,0.00,0.00%,21361187.00,United States,2021,105766,Technology,Computer Software: Prepackaged Software
DATSW,DatChat Inc. Series A Warrant,$0.2701,0.0001,0.037%,0.00,United States,2021,700,Technology,Computer Software: Prepackaged Software
DAVE,Dave Inc. Class A Common Stock,$0.6882,-0.0618,-8.24%,257254769.00,United States,,1012496,Technology,Retail: Computer Software & Peripheral Equipment
DAVEW,Dave Inc. Warrants,$0.085,0.0059,7.459%,0.00,United States,,19058,Technology,Retail: Computer Software & Peripheral Equipment
DAWN,Day One Biopharmaceuticals Inc. Common Stock,$17.90,0.35,1.994%,1287223529.00,United States,2021,759681,Health Care,Biotechnology: Pharmaceutical Preparations
DBGI,Digital Brands Group Inc. Common Stock,$0.1949,-0.0161,-7.63%,9991625.00,United States,2021,3361406,Consumer Discretionary,Apparel
DBGIW,Digital Brands Group Inc. Warrant,$0.1658,0.00,0.00%,0.00,United States,2021,1,Consumer Discretionary,Apparel
DBTX,Decibel Therapeutics Inc. Common Stock,$4.21,0.39,10.209%,105100553.00,United States,2021,1400225,Health Care,Biotechnology: Pharmaceutical Preparations
DBVT,DBV Technologies S.A. American Depositary Shares,$2.55,0.13,5.372%,478606292.00,France,2014,856944,Health Care,Biotechnology: Biological Products (No Diagnostic Substances)
DBX,Dropbox Inc. Class A Common Stock,$20.99,-0.33,-1.548%,7883928653.00,United States,2018,2487688,Technology,Computer Software: Prepackaged Software
DCBO,Docebo Inc. Common Shares,$28.67,-0.10,-0.348%,942772927.00,Canada,,65752,,
DCFC,Tritium DCFC Limited Ordinary Shares,$6.09,-0.09,-1.456%,824468433.00,Australia,,227026,Technology,Electronic Components
DCFCW,Tritium DCFC Limited Warrant,$1.33,0.00,0.00%,0.00,Australia,,41911,Technology,Electronic Components
DCGO,DocGo Inc. Common Stock,$7.14,0.16,2.292%,717817308.00,United States,2020,992689,Health Care,Managed Health Care
DCGOW,DocGo Inc. Warrants,$1.67,0.01,0.602%,0.00,United States,2020,1900,Health Care,Managed Health Care
DCOM,Dime Community Bancshares Inc. Common Stock,$29.65,-0.17,-0.57%,1163576239.00,United States,,106428,Finance,Savings Institutions
DCOMP,Dime Community Bancshares Inc. Fixed-Rate Non-Cumulative Perpetual Preferred Stock Series A,$20.55,0.30,1.481%,0.00,United States,,7611,Finance,Savings Institutions
DCPH,Deciphera Pharmaceuticals Inc. Common Stock,$13.15,-0.31,-2.303%,870747093.00,United States,2017,1351882,Health Care,Biotechnology: Pharmaceutical Preparations
DCRD,Decarbonization Plus Acquisition Corporation IV Class A Ordinary Share,$9.91,-0.014,-0.141%,391754688.00,United States,2021,2121,,
DCRDW,Decarbonization Plus Acquisition Corporation IV Warrant,$0.2002,-0.0498,-19.92%,0.00,United States,2021,5100,,
DCT,Duck Creek Technologies Inc. Common Stock,$14.85,-3.56,-19.337%,1967974524.00,United States,2020,3161712,Technology,Retail: Computer Software & Peripheral Equipment
DCTH,Delcath Systems Inc. Common Stock,$3.99,0.00,0.00%,31547845.00,United States,,49015,Health Care,Medical Specialities
DDI,DoubleDown Interactive Co. Ltd. American Depository Shares,$9.655,0.375,4.041%,478438463.00,South Korea,2021,1127,Technology,EDP Services
DDOG,Datadog Inc. Class A Common Stock,$95.24,-3.13,-3.182%,30002255366.00,United States,2019,4416737,Technology,EDP Services
DECA,Denali Capital Acquisition Corp. Class A Ordinary Shares,$9.92,-0.05,-0.502%,107359200.00,United States,2022,28025,,
DECAU,Denali Capital Acquisition Corp. Unit,$9.97,-0.0489,-0.488%,0.00,United States,2022,14032,,
DECAW,Denali Capital Acquisition Corp. Warrant,$0.10,-0.01,-9.091%,0.00,United States,2022,25000,,
DENN,Denny's Corporation Common Stock,$8.68,-0.25,-2.80%,535664083.00,United States,,1028190,Consumer Discretionary,Restaurants
DERM,Journey Medical Corporation Common Stock,$3.74,0.02,0.538%,65194162.00,United States,2021,2488,Health Care,Biotechnology: Pharmaceutical Preparations
DFFN,Diffusion Pharmaceuticals Inc. Common Stock,$6.68,-0.12,-1.765%,13617795.00,United States,,3663,Health Care,Biotechnology: Pharmaceutical Preparations
DFH,Dream Finders Homes Inc. Class A Common Stock,$10.64,0.10,0.949%,986960186.00,United States,2021,313226,,
DGHI,Digihost Technology Inc. Common Subordinate Voting Shares,$1.02,-0.11,-9.735%,28239631.00,Canada,,60181,,
DGICA,Donegal Group Inc. Class A Common Stock,$17.05,0.23,1.367%,535701452.00,United States,,125752,Finance,Property-Casualty Insurers
DGICB,Donegal Group Inc. Class B Common Stock,$15.98,0.00,0.00%,502082651.00,United States,1986,4,Finance,Property-Casualty Insurers
DGII,Digi International Inc. Common Stock,$24.22,0.70,2.976%,849752839.00,United States,1989,255848,Technology,Computer peripheral equipment
DGLY,Digital Ally Inc. Common Stock,$0.791,-0.0028,-0.353%,38322344.00,United States,,269811,Technology,Security Systems Services
DGNU,Dragoneer Growth Opportunities Corp. III Class A Ordinary Shares,$9.73,-0.03,-0.307%,523809763.00,United States,2021,110643,Finance,Business Services
DH,Definitive Healthcare Corp. Class A Common Stock,$22.93,-1.89,-7.615%,2239360722.00,United States,2021,664091,Technology,Computer Software: Prepackaged Software
DHAC,Digital Health Acquisition Corp. Common Stock,$10.03,0.03,0.30%,149767960.00,United States,2021,124,Industrials,Consumer Electronics/Appliances
DHACU,Digital Health Acquisition Corp. Unit,$10.10,-0.01,-0.099%,0.00,United States,2021,1820,Industrials,Consumer Electronics/Appliances
DHACW,Digital Health Acquisition Corp. Warrant,$0.11,-0.01,-8.333%,0.00,United States,2021,609,Industrials,Consumer Electronics/Appliances
DHBC,DHB Capital Corp. Class A common stock,$9.78,0.00,0.00%,351468750.00,United States,2021,50,Industrials,Consumer Electronics/Appliances
DHBCU,DHB Capital Corp. Unit,$9.81,0.00,0.00%,352546875.00,United States,2021,601,Industrials,Consumer Electronics/Appliances
DHBCW,DHB Capital Corp. Warrant,$0.12,0.02,20.00%,0.00,United States,2021,300,Industrials,Consumer Electronics/Appliances
DHC,Diversified Healthcare Trust Common Shares of Beneficial Interest,$1.82,-0.04,-2.151%,434958699.00,United States,,1720053,Real Estate,Real Estate Investment Trusts
DHCA,DHC Acquisition Corp. Class A ordinary share,$9.80,0.00,0.00%,379077132.00,United States,2021,19677,Finance,Business Services
DHCAU,DHC Acquisition Corp. Unit,$9.80,-0.074,-0.749%,0.00,United States,2021,12121,Finance,Business Services
DHCAW,DHC Acquisition Corp. Warrant,$0.0731,-0.0569,-43.769%,0.00,United States,2021,1329,Finance,Business Services
DHCNI,Diversified Healthcare Trust 5.625% Senior Notes due 2042,$16.275,0.125,0.774%,0.00,United States,,7934,Real Estate,Real Estate Investment Trusts
DHCNL,Diversified Healthcare Trust 6.25% Senior Notes Due 2046,$17.07,-0.03,-0.175%,0.00,United States,,37075,Real Estate,Real Estate Investment Trusts
DHHC,DiamondHead Holdings Corp. Class A Common Stock,$9.83,0.01,0.102%,423918750.00,United States,2021,184729,Industrials,Consumer Electronics/Appliances
DHHCU,DiamondHead Holdings Corp. Unit,$9.80,-0.02,-0.204%,0.00,United States,2021,50120,Industrials,Consumer Electronics/Appliances
DHIL,Diamond Hill Investment Group Inc. Class A Common Stock,$173.64,-0.46,-0.264%,550538990.00,United States,,8005,Finance,Investment Managers
DIBS,1stdibs.com Inc. Common Stock,$5.69,-0.02,-0.35%,216601537.00,United States,2021,87972,Miscellaneous,Diversified Commercial Services
DICE,DICE Therapeutics Inc. Common Stock,$15.52,0.24,1.571%,593318348.00,United States,2021,202656,Health Care,Biotechnology: Pharmaceutical Preparations
DILA,DILA Capital Acquisition Corp. Class A Common Stock,$9.85,0.00,0.00%,74657829.00,Mexico,2021,200,Industrials,Consumer Electronics/Appliances
DILAU,DILA Capital Acquisition Corp. Unit,$9.93,-0.02,-0.201%,0.00,Mexico,2021,100,Industrials,Consumer Electronics/Appliances
DILAW,DILA Capital Acquisition Corp. Warrant,$0.12,-0.0244,-16.898%,0.00,Mexico,2021,700,Industrials,Consumer Electronics/Appliances
DIOD,Diodes Incorporated Common Stock,$64.57,-0.44,-0.677%,2921615643.00,United States,,328468,Technology,Semiconductors
DISA,Disruptive Acquisition Corporation I Class A Ordinary Shares,$9.79,0.00,0.00%,336531250.00,United States,2021,4716,Finance,Business Services
DISAW,Disruptive Acquisition Corporation I Warrant,$0.06,-0.09,-60.00%,0.00,United States,2021,600,Finance,Business Services
DISH,DISH Network Corporation Class A Common Stock,$17.93,0.01,0.056%,9502839379.00,United States,1995,3416674,Consumer Discretionary,Telecommunications Equipment
DJCO,Daily Journal Corp. (S.C.) Common Stock,$258.80,-0.56,-0.216%,357337065.00,United States,,3908,Technology,Retail: Computer Software & Peripheral Equipment
DKDCU,Data Knights Acquisition Corp. Unit,$10.38,-0.04,-0.384%,0.00,United Kingdom,2021,1060,Industrials,Consumer Electronics/Appliances
DKDCW,Data Knights Acquisition Corp. Warrant,$0.0399,-0.0201,-33.50%,0.00,United Kingdom,2021,23978,Industrials,Consumer Electronics/Appliances
