Symbol,Name,Last Sale,Net Change,% Change,Market Cap,Country,IPO Year,Volume,Sector,Industry
REFI,Chicago Atlantic Real Estate Finance Inc. Common Stock,$15.06,-0.48,-3.089%,265928170.00,United States,2021,116182,Real Estate,Real Estate Investment Trusts
REFR,Research Frontiers Incorporated Common Stock,$1.74,0.03,1.754%,55071689.00,United States,,16722,Technology,Industrial Machinery/Components
REG,Regency Centers Corporation Common Stock,$59.31,-1.06,-1.756%,10222809970.00,United States,1993,1216594,Real Estate,Real Estate Investment Trusts
REGN,Regeneron Pharmaceuticals Inc. Common Stock,$591.13,-6.49,-1.086%,64933380659.00,United States,1991,685395,Health Care,Biotechnology: Pharmaceutical Preparations
REKR,Rekor Systems Inc. Common Stock,$1.76,-0.08,-4.348%,87779518.00,United States,,1500811,Technology,EDP Services
RELI,Reliance Global Group Inc. Common Stock,$2.11,-0.04,-1.86%,23921300.00,United States,,26339,Finance,Specialty Insurers
RELIW,Reliance Global Group Inc. Series A Warrants,$0.3749,-0.075,-16.67%,0.00,United States,,512,Finance,Specialty Insurers
RELL,Richardson Electronics Ltd. Common Stock,$14.66,-0.30,-2.005%,200277575.00,United States,1983,152534,Technology,Electronic Components
RELY,Remitly Global Inc. Common Stock,$7.66,-0.31,-3.89%,1273509240.00,United States,2021,654774,Technology,Computer Software: Prepackaged Software
RENEU,Cartesian Growth Corporation II Unit,$10.02,0.02,0.20%,0.00,United States,2022,3483,,
RENT,Rent the Runway Inc. Class A Common Stock,$3.07,-0.22,-6.687%,196707082.00,United States,2021,883791,Consumer Discretionary,Department/Specialty Retail Stores
REPL,Replimune Group Inc. Common Stock,$17.48,0.03,0.172%,857743513.00,United States,2018,121715,Health Care,Biotechnology: Pharmaceutical Preparations
RETA,Reata Pharmaceuticals Inc. Class A Common Stock,$30.39,-1.66,-5.179%,1108110084.00,United States,2016,245628,Health Care,Biotechnology: Pharmaceutical Preparations
RETO,ReTo Eco-Solutions Inc. Common Shares,$0.805,-0.0151,-1.841%,29896180.00,China,2017,7135,Consumer Discretionary,Multi-Sector Companies
REVB,Revelation Biosciences Inc. Common Stock,$1.11,0.4843,77.401%,16741876.00,United States,2020,111342758,Health Care,Biotechnology: Pharmaceutical Preparations
REVBU,Revelation Biosciences Inc. Unit,$4.37,-0.23,-5.00%,0.00,United States,2020,185,Health Care,Biotechnology: Pharmaceutical Preparations
REVBW,Revelation Biosciences Inc. Warrant,$0.0796,0.0258,47.955%,0.00,United States,2020,2172615,Health Care,Biotechnology: Pharmaceutical Preparations
REVE,Alpine Acquisition Corporation Common Stock,$10.29,0.16,1.579%,139429500.00,United States,2021,489,Industrials,Consumer Electronics/Appliances
REVEW,Alpine Acquisition Corporation Warrant,$0.11,-0.004,-3.509%,0.00,United States,2021,600,Industrials,Consumer Electronics/Appliances
REVH,Revolution Healthcare Acquisition Corp. SAIL Class A Common Stock,$9.77,0.01,0.102%,564217500.00,United States,2021,3270,Industrials,Consumer Electronics/Appliances
REVHU,Revolution Healthcare Acquisition Corp. SAIL Units,$9.81,0.00,0.00%,0.00,United States,2021,13,Industrials,Consumer Electronics/Appliances
REVHW,Revolution Healthcare Acquisition Corp. SAIL Warrant.,$0.2449,-0.0051,-2.04%,0.00,United States,2021,1270,Industrials,Consumer Electronics/Appliances
REYN,Reynolds Consumer Products Inc. Common Stock,$27.27,0.32,1.187%,5722954684.00,United States,2020,437375,Industrials,Office Equipment/Supplies/Services
RFAC,RF Acquisition Corp. Class A Common Stock,$9.86,0.01,0.102%,143709500.00,Singapore,2022,25100,Industrials,Consumer Electronics/Appliances
RFACU,RF Acquisition Corp. Unit,$10.00,-0.01,-0.10%,0.00,Singapore,2022,277,Industrials,Consumer Electronics/Appliances
RFACW,RF Acquisition Corp. Warrants,$0.09,0.00,0.00%,0.00,Singapore,2022,1041,Industrials,Consumer Electronics/Appliances
RFIL,RF Industries Ltd. Common Stock,$6.20,0.04,0.649%,62735847.00,United States,,19767,Technology,Electrical Products
RGC,Regencell Bioscience Holdings Limited Ordinary Shares,$34.605,3.1072,9.865%,450310228.00,Hong Kong,2021,4154,,
RGCO,RGC Resources Inc. Common Stock,$19.07,0.08,0.421%,186722418.00,United States,,3299,Utilities,Oil & Gas Production
RGEN,Repligen Corporation Common Stock,$162.40,-3.45,-2.08%,9002345346.00,United States,1986,364455,Health Care,Medical/Dental Instruments
RGF,The Real Good Food Company Inc. Class A Common Stock,$7.03,0.30,4.458%,181005389.00,United States,2021,13460,Consumer Discretionary,Food Distributors
RGLD,Royal Gold Inc. Common Stock,$106.78,-2.63,-2.404%,7008934769.00,United States,,367624,Industrials,Consumer Electronics/Appliances
RGLS,Regulus Therapeutics Inc. Common Stock,$2.07,-0.03,-1.429%,30218104.00,United States,2012,126467,Health Care,Biotechnology: Pharmaceutical Preparations
RGNX,REGENXBIO Inc. Common Stock,$24.70,0.44,1.814%,1065407997.00,United States,2015,323195,Health Care,Biotechnology: Biological Products (No Diagnostic Substances)
RGP,Resources Connection Inc. Common Stock,$20.37,0.93,4.784%,674344898.00,United States,,359865,Consumer Discretionary,Business Services
RGTI,Rigetti Computing Inc. Common Stock,$3.67,0.29,8.58%,421520261.00,United States,,1324630,Technology,Retail: Computer Software & Peripheral Equipment
RGTIW,Rigetti Computing Inc. Warrants,$0.65,0.08,14.035%,0.00,United States,,11149,Technology,Retail: Computer Software & Peripheral Equipment
RIBT,RiceBran Technologies Common Stock,$0.67,0.1529,29.569%,34953328.00,United States,,35526190,Consumer Staples,Specialty Foods
RICK,RCI Hospitality Holdings Inc. Common Stock,$48.36,-0.10,-0.206%,455385180.00,United States,1995,49090,Consumer Discretionary,Restaurants
RIDE,Lordstown Motors Corp. Class A Common Stock,$1.58,-0.15,-8.671%,321484923.00,United States,2019,5517235,Consumer Discretionary,Construction/Ag Equipment/Trucks
RIGL,Rigel Pharmaceuticals Inc. Common Stock,$1.13,0.10,9.709%,194419013.00,United States,2000,4045367,Health Care,Biotechnology: Pharmaceutical Preparations
RILY,B. Riley Financial Inc. Common Stock,$42.25,-0.88,-2.04%,1179967887.00,United States,,224770,Finance,Investment Managers
RILYG,B. Riley Financial Inc. 5.00% Senior Notes due 2026,$22.60,0.00,0.00%,0.00,United States,,13796,Consumer Discretionary,Business Services
RILYK,B. Riley Financial Inc. 5.50% Senior Notes Due 2026,$24.00,0.00,0.00%,0.00,United States,,10161,Consumer Discretionary,Business Services
RILYL,B. Riley Financial Inc. Depositary Shares each representing 1/1000th in a share of 7.375% Series B Cumulative Perpetual Preferred Stock par value $0.0001,$24.85,-0.01,-0.04%,0.00,United States,,1439,Finance,Investment Managers
RILYM,B. Riley Financial Inc. 6.375% Senior Notes due 2025,$24.65,0.13,0.53%,0.00,United States,,13240,Consumer Discretionary,Business Services
RILYN,B. Riley Financial Inc. 6.50% Senior Notes Due 2026,$24.52,0.06,0.245%,0.00,United States,,8198,Consumer Discretionary,Business Services
RILYO,B. Riley Financial Inc. 6.75% Senior Notes due 2024,$25.02,0.02,0.08%,0.00,United States,,13970,Consumer Discretionary,Business Services
RILYP,B. Riley Financial Inc. Depositary Shares each representing a 1/1000th fractional interest in a share of Series A Cumulative Perpetual Preferred Stock,$21.87,-0.31,-1.398%,0.00,United States,,10507,Finance,Investment Managers
RILYT,B. Riley Financial Inc. 6.00% Senior Notes Due 2028,$22.82,-0.07,-0.306%,0.00,United States,,3376,Consumer Discretionary,Business Services
RILYZ,B. Riley Financial Inc. 5.25% Senior Notes due 2028,$21.83,0.055,0.253%,0.00,United States,,15598,Consumer Discretionary,Business Services
RIOT,Riot Blockchain Inc.  Common Stock ,$4.19,-0.31,-6.889%,567107701.00,United States,,10576280,Technology,Retail: Computer Software & Peripheral Equipment
RIVN,Rivian Automotive Inc. Class A Common Stock,$25.74,-0.53,-2.018%,23182928143.00,United States,2021,11625581,Consumer Discretionary,Auto Manufacturing
RKDA,Arcadia Biosciences Inc. Common Stock,$1.00,-0.01,-0.99%,22188918.00,United States,2015,713116,Industrials,Agricultural Chemicals
RKLB,Rocket Lab USA Inc. Common Stock,$3.79,0.07,1.882%,1757816357.00,United States,2020,4952240,Industrials,Aerospace
RLAY,Relay Therapeutics Inc. Common Stock,$16.75,-0.04,-0.238%,1820033761.00,United States,2020,710120,Health Care,Biotechnology: Pharmaceutical Preparations
RLMD,Relmada Therapeutics Inc. Common Stock,$18.99,-0.35,-1.81%,569525102.00,United States,,246875,Health Care,Biotechnology: Pharmaceutical Preparations
RLYB,Rallybio Corporation Common Stock,$7.55,0.51,7.244%,242588824.00,United States,2021,46005,Health Care,Biotechnology: Pharmaceutical Preparations
RMBI,Richmond Mutual Bancorporation Inc. Common Stock,$13.98,-0.04,-0.285%,167126091.00,United States,2019,3524,,
RMBL,RumbleOn Inc. Class B Common Stock,$14.71,0.17,1.169%,243516239.00,United States,,145291,Consumer Discretionary,Automotive Aftermarket
RMBS,Rambus Inc. Common Stock,$21.49,-0.11,-0.509%,2368963216.00,United States,1997,970739,Technology,Semiconductors
RMCF,Rocky Mountain Chocolate Factory Inc. Common Stock,$6.89,-0.04,-0.577%,42767367.00,United States,,8682,Consumer Staples,Specialty Foods
RMGC,RMG Acquisition Corp. III Class A Ordinary Shares,$9.83,0.00,0.00%,593486250.00,United States,2021,264737,Finance,Business Services
RMGCU,RMG Acquisition Corp. III Unit,$9.87,0.04,0.407%,0.00,United States,2021,56018,Finance,Business Services
RMGCW,RMG Acquisition Corp. III Warrant,$0.08,-0.0051,-5.993%,0.00,United States,2021,1100,Finance,Business Services
RMNI,Rimini Street Inc. (DE) Common Stock,$6.01,-0.02,-0.332%,523110400.00,United States,2015,232969,Technology,EDP Services
RMR,The RMR Group Inc. Class A Common Stock,$28.35,-0.13,-0.456%,467818546.00,United States,,24690,Finance,Real Estate
RMTI,Rockwell Medical Inc. Common Stock,$1.29,-0.06,-4.444%,12096447.00,United States,1998,25661,Health Care,Biotechnology: Pharmaceutical Preparations
RNA,Avidity Biosciences Inc. Common Stock,$14.53,0.23,1.608%,723061664.00,United States,2020,385833,Health Care,Biotechnology: Pharmaceutical Preparations
RNAZ,TransCode Therapeutics Inc. Common Stock,$1.26,-0.03,-2.326%,16351315.00,United States,2021,47126,Health Care,Biotechnology: Pharmaceutical Preparations
RNDB,Randolph Bancorp Inc. Common Stock,$26.45,0.14,0.532%,137142827.00,United States,2016,14935,Finance,Major Banks
RNER,Mount Rainier Acquisition Corp. Common Stock,$10.06,0.045,0.449%,222916522.00,United States,2022,200,Industrials,Consumer Electronics/Appliances
RNLX,Renalytix plc American Depositary Shares,$2.45,-1.52,-38.287%,91581529.00,United Kingdom,2020,1402747,Health Care,Medical Specialities
RNST,Renasant Corporation Common Stock,$28.81,-0.28,-0.963%,1610481766.00,United States,,324925,Finance,Major Banks
RNW,ReNew Energy Global plc Class A Ordinary Shares,$6.47,0.18,2.862%,2593171122.00,United Kingdom,,945847,,
RNWK,RealNetworks Inc. Common Stock,$0.631,0.0094,1.512%,29854382.00,United States,1997,55053,Technology,EDP Services
RNWWW,ReNew Energy Global plc Warrant,$1.0301,0.00,0.00%,0.00,United Kingdom,,162,,
RNXT,RenovoRx Inc. Common Stock,$1.98,-0.02,-1.00%,17952389.00,United States,2021,1252,Health Care,Biotechnology: Pharmaceutical Preparations
ROAD,Construction Partners Inc. Class A Common Stock,$20.94,0.60,2.95%,1100291337.00,United States,2018,158433,Industrials,Engineering & Construction
ROC,ROC Energy Acquisition Corp. Common Stock,$9.96,-0.025,-0.25%,267435960.00,United States,2021,7608,Industrials,Consumer Electronics/Appliances
ROCAR,ROC Energy Acquisition Corp. Rights,$0.16,-0.0285,-15.119%,0.00,United States,2021,22040,Industrials,Consumer Electronics/Appliances
ROCAU,ROC Energy Acquisition Corp. Unit,$10.05,-0.06,-0.593%,0.00,United States,2021,1670,Industrials,Consumer Electronics/Appliances
ROCC,Ranger Oil Corporation Class A Common Stock,$32.87,0.43,1.326%,695640761.00,United States,,953012,Energy,Oil & Gas Production
ROCG,Roth CH Acquisition IV Co. Common Stock,$9.9301,0.00,0.00%,147327929.00,United States,2021,10,Industrials,Consumer Electronics/Appliances
ROCGU,Roth CH Acquisition IV Co. Unit,$10.07,-0.07,-0.69%,0.00,United States,2021,7011,Industrials,Consumer Electronics/Appliances
ROCGW,Roth CH Acquisition IV Co. Warrant,$0.21,0.0599,39.907%,0.00,United States,2021,15944,Industrials,Consumer Electronics/Appliances
ROCK,Gibraltar Industries Inc. Common Stock,$38.75,0.18,0.467%,1270741654.00,United States,1993,236879,,
ROCL,Roth CH Acquisition V Co. Common Stock,$10.05,0.00,0.00%,149106825.00,United States,2022,2,Industrials,Consumer Electronics/Appliances
ROCLU,Roth CH Acquisition V Co. Unit,$9.90,0.00,0.00%,0.00,United States,2021,2,Industrials,Consumer Electronics/Appliances
ROCLW,Roth CH Acquisition V Co. Warrant,$0.165,-0.025,-13.158%,0.00,United States,2022,2381,Industrials,Consumer Electronics/Appliances
ROIC,Retail Opportunity Investments Corp. Common Stock (MD),$15.78,-0.32,-1.988%,1959928958.00,United States,,1550278,Real Estate,Real Estate Investment Trusts
ROIV,Roivant Sciences Ltd. Common Shares,$4.07,-0.42,-9.354%,2852117286.00,United Kingdom,,1290388,,
ROIVW,Roivant Sciences Ltd. Warrant,$0.60,0.05,9.091%,0.00,United Kingdom,,45866,,
ROKU,Roku Inc. Class A Common Stock,$82.14,-4.97,-5.705%,11168778193.00,United States,2017,6691604,Telecommunications,Cable & Other Pay Television Services
ROLL,RBC Bearings Incorporated Common Stock,$184.95,2.22,1.215%,5341474368.00,United States,2005,170850,Industrials,Metal Fabrications
ROLLP,RBC Bearings Incorporated 5.00% Series A Mandatory Convertible Preferred Stock,$94.38,0.28,0.298%,0.00,United States,,382,Industrials,Metal Fabrications
ROOT,Root Inc. Class A Common Stock,$1.19,0.03,2.586%,302855000.00,United States,2020,1629271,Finance,Property-Casualty Insurers
ROSE,Rose Hill Acquisition Corporation Class A Ordinary Shares,$10.04,0.00,0.00%,194838750.00,United States,2021,2,,
ROSEU,Rose Hill Acquisition Corporation Unit,$10.03,-0.12,-1.182%,0.00,United States,2021,100,,
ROSEW,Rose Hill Acquisition Corporation Warrant,$0.2499,0.0499,24.95%,0.00,United States,2021,1200,,
ROST,Ross Stores Inc. Common Stock,$70.23,-1.58,-2.20%,24575331142.00,United States,1985,5529808,Consumer Discretionary,Clothing/Shoe/Accessory Stores
ROVR,Rover Group Inc. Class A Common Stock,$3.76,0.03,0.804%,684090648.00,United States,2021,622969,Consumer Discretionary,Other Consumer Services
RPAY,Repay Holdings Corporation Class A Common Stock,$12.85,0.11,0.863%,1173309599.00,United States,2018,490287,Technology,EDP Services
RPD,Rapid7 Inc. Common Stock,$66.80,-2.24,-3.244%,3892067865.00,United States,2015,480629,Technology,Computer Software: Prepackaged Software
RPHM,Reneo Pharmaceuticals Inc. Common Stock,$2.65,0.32,13.734%,64815158.00,United States,2021,171742,Health Care,Biotechnology: Pharmaceutical Preparations
RPID,Rapid Micro Biosystems Inc. Class A Common Stock,$4.30,1.12,35.22%,180352544.00,United States,2021,7359834,Health Care,Medical Specialities
RPRX,Royalty Pharma plc Class A Ordinary Shares ,$42.04,-0.05,-0.119%,18300702297.00,United States,2020,1549705,Health Care,Biotechnology: Pharmaceutical Preparations
RPTX,Repare Therapeutics Inc. Common Shares,$13.99,0.38,2.792%,586100348.00,Canada,2020,105331,,
RRBI,Red River Bancshares Inc. Common Stock,$54.08,-0.35,-0.643%,388097819.00,United States,2019,3128,Finance,Commercial Banks
RRGB,Red Robin Gourmet Burgers Inc. Common Stock,$8.03,0.06,0.753%,126764808.00,United States,2002,354193,Consumer Discretionary,Restaurants
RRR,Red Rock Resorts Inc. Class A Common Stock,$33.36,-0.21,-0.626%,2050706320.00,United States,2016,628446,Consumer Discretionary,Recreational Games/Products/Toys
RSLS,ReShape Lifesciences Inc. Common Stock,$0.5768,0.0128,2.27%,9137772.00,United States,2016,99590,Health Care,Biotechnology: Electromedical & Electrotherapeutic Apparatus
RSSS,Research Solutions Inc Common Stock,$1.78,0.03,1.714%,48174303.00,United States,,20455,Technology,Computer Software: Prepackaged Software
RSVR,Reservoir Media Inc. Common Stock,$6.52,-0.18,-2.687%,418808607.00,United States,2021,141309,Consumer Discretionary,Movies/Entertainment
RSVRW,Reservoir Media Inc. Warrant,$1.42,0.00,0.00%,0.00,United States,2021,4,Consumer Discretionary,Movies/Entertainment
RTL,The Necessity Retail REIT Inc. Class A Common Stock,$7.28,-0.02,-0.274%,968539157.00,United States,,501831,Real Estate,Real Estate Investment Trusts
RTLPO,The Necessity Retail REIT Inc. 7.375% Series C Cumulative Redeemable Preferred Stock,$22.48,0.24,1.079%,0.00,United States,,12597,Real Estate,Real Estate Investment Trusts
RTLPP,The Necessity Retail REIT Inc. 7.50% Series A Cumulative Redeemable Perpetual Preferred Stock,$22.14,-0.02,-0.09%,0.00,United States,,23641,Real Estate,Real Estate Investment Trusts
RTLR,Rattler Midstream LP Common Units,$13.65,-0.07,-0.51%,520693542.00,United States,2019,1899519,Energy,Oilfield Services/Equipment
RUBY,Rubius Therapeutics Inc. Common Stock,$0.8507,-0.0501,-5.562%,76866727.00,United States,2018,403874,Health Care,Biotechnology: Biological Products (No Diagnostic Substances)
RUN,Sunrun Inc. Common Stock,$23.36,1.16,5.225%,4908228304.00,United States,2015,7862954,Industrials,Building Products
RUSHA,Rush Enterprises Inc. Common Stock Cl A,$48.20,-0.11,-0.228%,2668058269.00,United States,,145466,Consumer Discretionary,Other Specialty Stores
RUSHB,Rush Enterprises Inc. Class B,$49.61,-0.34,-0.681%,2746107277.00,United States,,24514,Consumer Discretionary,Other Specialty Stores
RUTH,Ruth's Hospitality Group Inc. Common Stock,$16.26,-0.19,-1.155%,558085281.00,United States,2005,381003,Consumer Discretionary,Restaurants
RVAC,Riverview Acquisition Corp. Class A Common Stock,$9.925,-0.005,-0.05%,310156250.00,United States,2021,43556,Industrials,Consumer Electronics/Appliances
RVACW,Riverview Acquisition Corp. Warrant,$0.97,-0.0057,-0.584%,0.00,United States,2021,3313,Industrials,Consumer Electronics/Appliances
RVLP,RVL Pharmaceuticals plc Ordinary Shares,$1.36,0.04,3.03%,113627536.00,United States,2018,52511,Health Care,Biotechnology: Pharmaceutical Preparations
RVMD,Revolution Medicines Inc. Common Stock,$19.49,0.41,2.149%,1447037759.00,United States,2020,740348,Consumer Discretionary,Specialty Chemicals
RVNC,Revance Therapeutics Inc. Common Stock,$13.82,-0.41,-2.881%,1005655985.00,United States,2014,702784,Health Care,Biotechnology: Pharmaceutical Preparations
RVPH,Reviva Pharmaceuticals Holdings Inc. Common Stock ,$1.10,0.0194,1.795%,5648008.00,United States,2020,220096,Health Care,Biotechnology: Pharmaceutical Preparations
RVPHW,Reviva Pharmaceuticals Holdings Inc. Warrants,$0.1801,-0.0199,-9.95%,0.00,United States,2018,3510,Health Care,Biotechnology: Pharmaceutical Preparations
RVSB,Riverview Bancorp Inc Common Stock,$6.58,0.01,0.152%,145608208.00,United States,,10783,Finance,Major Banks
RVSN,Rail Vision Ltd. Ordinary Share,$0.891,0.0631,7.622%,14163416.00,Israel,2022,145464,,
RVSNW,Rail Vision Ltd. Warrant,$0.1783,-0.0002,-0.112%,0.00,Israel,2022,1000,,
RWAY,Runway Growth Finance Corp. Common Stock,$11.31,0.33,3.005%,466949930.00,United States,2021,87259,,
RWLK,ReWalk Robotics Ltd. Ordinary Shares,$0.94,0.02,2.174%,58821965.00,Israel,2014,162029,Health Care,Industrial Specialties
RWOD,Redwoods Acquisition Corp. Common Stock,$9.88,0.00,0.00%,147261400.00,United States,2022,10333,Industrials,Consumer Electronics/Appliances
RWODR,Redwoods Acquisition Corp. Rights,$0.1001,0.02,24.969%,0.00,United States,2022,6205,,
RWODU,Redwoods Acquisition Corp. Unit,$10.00,0.06,0.604%,0.00,United States,2022,12918,Industrials,Consumer Electronics/Appliances
RWODW,Redwoods Acquisition Corp. Warrants,$0.07,0.00,0.00%,0.00,United States,2022,1618,Industrials,Consumer Electronics/Appliances
RXDX,Prometheus Biosciences Inc. Common Stock,$28.23,0.41,1.474%,1106556463.00,United States,2021,1273215,Health Care,Biotechnology: Pharmaceutical Preparations
RXRA,RXR Acquisition Corp. Class A Common Stock,$9.79,-0.02,-0.204%,422193750.00,United States,2021,1554,Industrials,Consumer Electronics/Appliances
RXRX,Recursion Pharmaceuticals Inc. Class A Common Stock,$8.14,0.09,1.118%,1400139959.00,United States,2021,580821,Health Care,Biotechnology: Pharmaceutical Preparations
RXST,RxSight Inc. Common Stock,$14.08,0.08,0.571%,387272413.00,United States,2021,47877,Health Care,Biotechnology: Electromedical & Electrotherapeutic Apparatus
RXT,Rackspace Technology Inc. Common Stock,$7.17,-0.05,-0.693%,1511862787.00,United States,2020,659300,Technology,EDP Services
RYAAY,Ryanair Holdings plc American Depositary Shares,$67.25,-2.26,-3.251%,15260619161.00,Ireland,1997,687090,Consumer Discretionary,Air Freight/Delivery Services
RYTM,Rhythm Pharmaceuticals Inc. Common Stock,$4.15,-0.12,-2.81%,209133984.00,United States,2017,370167,Health Care,Biotechnology: Pharmaceutical Preparations
RZLT,Rezolute Inc. Common Stock (NV),$3.23,-0.01,-0.309%,108472544.00,United States,,19498,Health Care,Biotechnology: Pharmaceutical Preparations
SABR,Sabre Corporation Common Stock,$5.83,-0.29,-4.739%,1902857250.00,United States,2014,7302175,Consumer Discretionary,Other Consumer Services
SABRP,Sabre Corporation 6.50% Series A Mandatory Convertible Preferred Stock,$79.75,-2.8675,-3.471%,0.00,United States,,583,Consumer Discretionary,Other Consumer Services
SABS,SAB Biotherapeutics Inc. Common Stock,$1.45,0.06,4.317%,62332050.00,United States,2021,14052,Health Care,Biotechnology: Pharmaceutical Preparations
SABSW,SAB Biotherapeutics Inc. Warrant,$0.1899,0.00,0.00%,0.00,United States,2021,31,Health Care,Biotechnology: Pharmaceutical Preparations
SAFM,Sanderson Farms Inc. Common Stock,$215.53,-3.08,-1.409%,4810670982.00,United States,1987,544162,,
SAFT,Safety Insurance Group Inc. Common Stock,$97.10,1.72,1.803%,1431407321.00,United States,2002,66487,Finance,Property-Casualty Insurers
SAGA,Sagaliam Acquisition Corp. Class A Common Stock,$9.89,-0.05,-0.503%,147262100.00,United States,2022,326131,Industrials,Consumer Electronics/Appliances
SAGAR,Sagaliam Acquisition Corp. Rights,$0.1511,0.0211,16.231%,0.00,United States,2022,9515,,
SAGAU,Sagaliam Acquisition Corp. Units,$10.02,0.06,0.602%,0.00,United States,2021,15029,Industrials,Consumer Electronics/Appliances
SAGE,Sage Therapeutics Inc. Common Stock,$32.30,-0.51,-1.554%,1907836613.00,United States,2014,513781,Health Care,Biotechnology: Pharmaceutical Preparations
SAI,SAI.TECH Global Corporation Class A Ordinary Shares,$4.01,-0.01,-0.249%,51863949.00,Singapore,2021,7273,Finance,Investment Bankers/Brokers/Service
SAIA,Saia Inc. Common Stock,$188.00,4.25,2.313%,4964779576.00,United States,,470132,Industrials,Trucking Freight/Courier Services
SAITW,SAI.TECH Global Corporation Warrant,$0.1493,-0.0203,-11.969%,0.00,Singapore,2021,5854,Finance,Investment Bankers/Brokers/Service
SAL,Salisbury Bancorp Inc. Common Stock,$47.22,-0.08,-0.169%,136275409.00,United States,,2823,Finance,Savings Institutions
SALM,Salem Media Group Inc. Class A Common Stock,$2.12,-0.14,-6.195%,57695348.00,United States,1999,255824,Consumer Discretionary,Broadcasting
SAMA,Schultze Special Purpose Acquisition Corp. II Class A Common Stock,$9.84,0.00,0.00%,202950000.00,United States,2021,7,Industrials,Consumer Electronics/Appliances
SAMAU,Schultze Special Purpose Acquisition Corp. II Units,$9.87,0.00,0.00%,0.00,United States,2021,5,Industrials,Consumer Electronics/Appliances
SAMAW,Schultze Special Purpose Acquisition Corp. II Warrant,$0.1919,0.0519,37.071%,0.00,United States,2021,2395,Industrials,Consumer Electronics/Appliances
SAMG,Silvercrest Asset Management Group Inc. Class A Common Stock,$16.41,-0.23,-1.382%,237430940.00,United States,2013,88500,Finance,Investment Managers
SANA,Sana Biotechnology Inc. Common Stock,$6.43,0.18,2.88%,1219564777.00,United States,2021,2262921,Consumer Discretionary,Specialty Chemicals
SANB,Sanaby Health Acquisition Corp. I Class A Common Stock,$10.04,-0.01,-0.10%,225147000.00,United States,2021,21372,Industrials,Consumer Electronics/Appliances
SANBW,Sanaby Health Acquisition Corp. I Warrant,$0.115,0.00,0.00%,0.00,United States,2021,7810,Industrials,Consumer Electronics/Appliances
SANG,Sangoma Technologies Corporation Common Shares,$8.40,0.00,0.00%,180090389.00,Canada,,1,,
SANM,Sanmina Corporation Common Stock,$40.73,-0.31,-0.755%,2478181741.00,United States,1993,406495,Technology,Electrical Products
SANW,S&W Seed Company Common Stock (NV),$1.00,0.027,2.775%,41559732.00,United States,,305686,Consumer Staples,Farming/Seeds/Milling
SASI,Sigma Labs Inc. Common Stock,$1.28,0.03,2.40%,7462400.00,United States,,6921,Technology,EDP Services
SASR,Sandy Spring Bancorp Inc. Common Stock,$39.07,-0.11,-0.281%,1767517306.00,United States,,97894,Finance,Major Banks
SATL,Satellogic Inc. Class A Ordinary Shares,$4.09,0.15,3.807%,371124739.00,Uruguay,,56389,,
SATLW,Satellogic Inc. Warrant,$0.48,0.105,28.00%,0.00,Uruguay,,180,,
SATS,EchoStar  Corporation Common Stock,$19.30,-0.24,-1.228%,1615580052.00,United States,,266329,Technology,Radio And Television Broadcasting And Communications Equipment
SAVA,Cassava Sciences Inc. Common Stock,$28.12,-1.63,-5.479%,1127070409.00,United States,,936062,Health Care,Biotechnology: Pharmaceutical Preparations
SBAC,SBA Communications Corporation Class A Common Stock,$320.05,2.82,0.889%,34510687773.00,United States,1999,790209,Real Estate,Real Estate Investment Trusts
SBCF,Seacoast Banking Corporation of Florida Common Stock,$33.04,0.02,0.061%,2029003944.00,United States,,336920,Finance,Major Banks
SBET,SharpLink Gaming Ltd. Ordinary Shares,$0.8951,-0.0058,-0.644%,20015319.00,Israel,,28853,Utilities,Telecommunications Equipment
SBFG,SB Financial Group Inc. Common Stock,$17.26,0.05,0.291%,123649518.00,United States,,4916,Finance,Major Banks
SBFM,Sunshine Biopharma Inc. Common Stock,$1.08,-0.01,-0.917%,17815256.00,Canada,,671641,Health Care,Biotechnology: Pharmaceutical Preparations
