Symbol,Name,Last Sale,Net Change,% Change,Market Cap,Country,IPO Year,Volume,Sector,Industry
HXL,Hexcel Corporation Common Stock,$52.31,0.13,0.249%,4396724288.00,United States,,520909,Industrials,Industrial Machinery/Components
HY,Hyster-Yale Materials Handling Inc. Class A Common Stock,$32.22,0.13,0.405%,544820127.00,United States,,41498,Industrials,Construction/Ag Equipment/Trucks
HYB,New America High Income Fund Inc. (The) Common Stock,$6.81,0.02,0.295%,159182007.00,United States,1988,96687,Finance,Investment Managers
HYI,Western Asset High Yield Defined Opportunity Fund Inc. Common Stock,$12.18,0.13,1.079%,275968642.00,,2010,87870,Finance,Investment Managers
HYLN,Hyliion Holdings Corp. Class A Common Stock,$3.22,0.09,2.875%,559760975.00,,2019,1630560,Consumer Discretionary,Auto Parts:O.E.M.
HYT,Blackrock Corporate High Yield Fund Inc. Common Stock,$9.53,0.07,0.74%,1165134426.00,United States,2003,499909,Finance,Finance Companies
HZN,Horizon Global Corporation Common Shares,$1.63,-0.05,-2.976%,45005149.00,United States,2015,30332,Consumer Discretionary,Auto Parts:O.E.M.
HZO,MarineMax Inc.  (FL) Common Stock,$36.12,-1.05,-2.825%,777723848.00,United States,1998,297314,Consumer Discretionary,Other Specialty Stores
HZON,Horizon Acquisition Corporation II Class A Ordinary Shares,$9.91,0.01,0.101%,650343750.00,United States,2020,118301,Finance,Business Services
IAA,IAA Inc. Common Stock ,$32.77,-0.85,-2.528%,4391415452.00,,2019,1922263,Consumer Discretionary,Business Services
IACC,ION Acquisition Corp 3 Ltd. Class A Ordinary Shares,$9.75,0.00,0.00%,315714750.00,,2021,100342,,
IAE,Voya Asia Pacific High Dividend Equity Income Fund ING Asia Pacific High Dividend Equity Income Fund Common Shares of Beneficial Interest,$6.96,-0.03,-0.429%,82778245.00,United States,2007,51771,Finance,Trusts Except Educational Religious and Charitable
IAG,Iamgold Corporation Ordinary Shares,$1.61,-0.11,-6.395%,771029000.00,Canada,,7996810,,
IBA,Industrias Bachoco S.A.B. de C.V. Common Stock,$43.35,-0.64,-1.455%,2167500000.00,Mexico,1997,14013,Consumer Staples,Meat/Poultry/Fish
IBER,Ibere Pharmaceuticals Class A Ordinary Shares,$9.81,0.00,0.00%,169222500.00,,2021,24916,,
IBM,International Business Machines Corporation Common Stock,$141.19,0.48,0.341%,126991273537.00,United States,,4874231,Technology,EDP Services
IBN,ICICI Bank Limited Common Stock,$17.74,-0.01,-0.056%,61688707452.00,India,,9059364,Finance,Commercial Banks
IBP,Installed Building Products Inc. Common Stock,$83.16,2.05,2.527%,2436218354.00,,2014,218704,Consumer Discretionary,Engineering & Construction
ICD,Independence Contract Drilling Inc. Common Stock,$3.13,-0.25,-7.396%,42621226.00,,2014,77673,Energy,Oil & Gas Production
ICE,Intercontinental Exchange Inc. Common Stock,$94.04,-2.37,-2.458%,52499362758.00,United States,2005,2917099,Finance,Investment Bankers/Brokers/Service
ICL,ICL Group Ltd. Ordinary Shares,$9.08,-0.29,-3.095%,11687330553.00,Israel,2014,911174,Industrials,Agricultural Chemicals
ICNC,Iconic Sports Acquisition Corp. Class A Ordinary Shares,$10.00,0.00,0.00%,431250000.00,,2021,142540,,
ICR^A,InPoint Commercial Real Estate Income Inc. 6.75% Series A Cumulative Redeemable Preferred Stock,$18.36,0.07,0.383%,,,,8363,,
IDA,IDACORP Inc. Common Stock,$105.92,0.37,0.351%,5355226651.00,United States,,206099,Utilities,Electric Utilities: Central
IDE,Voya Infrastructure Industrials and Materials Fund Common Shares of Beneficial Interest,$9.77,-0.04,-0.408%,160809481.00,United States,2010,44515,Finance,Finance/Investors Services
IDT,IDT Corporation Class B Common Stock,$25.15,0.09,0.359%,659960848.00,United States,,131459,Telecommunications,Telecommunications Equipment
IEX,IDEX Corporation Common Stock,$181.63,0.55,0.304%,13804898399.00,United States,1989,349575,Industrials,Fluid Controls
IFF,International Flavors & Fragrances Inc. Common Stock,$119.12,1.74,1.482%,30356304585.00,United States,,1308518,Industrials,Major Chemicals
IFIN,InFinT Acquisition Corporation Class A Ordinary Shares,$10.03,-0.07,-0.693%,259104619.00,,2022,57983,,
IFN,India Fund Inc. (The) Common Stock,$16.30,-0.07,-0.428%,445271322.00,United States,,62320,Finance,Finance/Investors Services
IFS,Intercorp Financial Services Inc. Common Shares,$23.40,0.25,1.08%,2700772565.00,,2019,85812,Finance,Commercial Banks
IGA,Voya Global Advantage and Premium Opportunity Fund Common Shares of Beneficial Interest,$9.11,-0.03,-0.328%,148636728.00,United States,2005,65610,Finance,Investment Managers
IGD,Voya Global Equity Dividend and Premium Opportunity Fund,$5.50,0.00,0.00%,444016837.00,United States,2005,199065,Finance,Trusts Except Educational Religious and Charitable
IGI,Western Asset Investment Grade Defined Opportunity Trust Inc. Common Stock,$16.87,0.23,1.382%,183006131.00,United States,2009,27470,Finance,Investment Managers
IGR,CBRE Global Real Estate Income Fund Common Shares of Beneficial Interest,$7.26,0.02,0.276%,846446986.00,United States,2004,462197,Finance,Finance Companies
IGT,International Game Technology Ordinary Shares,$18.56,-0.64,-3.333%,3765934692.00,United States,2015,1809608,Consumer Discretionary,Movies/Entertainment
IH,iHuman Inc. American depositary shares each representing five Class A ordinary shares,$2.36,-0.07,-2.881%,125982327.00,United States,2020,8643,Real Estate,Other Consumer Services
IHD,Voya Emerging Markets High Income Dividend Equity Fund Common Shares,$5.76,-0.06,-1.031%,109102527.00,United States,2011,48562,Finance,Investment Managers
IHG,Intercontinental Hotels Group American Depositary Shares (Each representing one Ordinary Share),$54.05,0.26,0.483%,9946081664.00,United Kingdom,,172622,Consumer Discretionary,Hotels/Resorts
IHIT,Invesco High Income 2023 Target Term Fund Common Shares of Beneficial Interest,$8.56,0.01,0.117%,206634266.00,United States,2016,28924,Finance,Investment Managers
IHS,IHS Holding Limited Ordinary Shares,$10.44,0.14,1.359%,3462822720.00,,2021,93479,,
IHTA,Invesco High Income 2024 Target Term Fund Common Shares of Beneficial Interest No par value per share,$8.61,0.04,0.467%,75644541.00,,2017,6595,Finance,Finance/Investors Services
IIF,Morgan Stanley India Investment Fund Inc. Common Stock,$22.35,0.02,0.09%,244552962.00,United States,1994,7140,Finance,Trusts Except Educational Religious and Charitable
IIIN,Insteel Industries Inc. Common Stock,$33.67,-0.11,-0.326%,654518066.00,United States,,128172,,
IIM,Invesco Value Municipal Income Trust Common Stock,$12.87,0.15,1.179%,605770810.00,United States,,218804,Finance,Investment Managers
IIPR,Innovative Industrial Properties Inc. Common Stock,$109.87,-0.78,-0.705%,3073131800.00,United States,2016,268357,Real Estate,Real Estate Investment Trusts
IIPR^A,Innovative Industrial Properties Inc. 9.00% Series A Cumulative Redeemable Preferred Stock,$26.11,0.11,0.423%,,United States,,1477,,
IMAX,Imax Corporation Common Stock,$16.89,0.22,1.32%,988433844.00,Canada,,526017,,
IMPX,AEA-Bridges Impact Corp. Class A Ordinary Shares,$9.92,-0.01,-0.101%,496000000.00,,2020,194798,Finance,Business Services
INAQ,Insight Acquisition Corp. Class A Common Stock,$9.82,0.00,0.00%,294600000.00,,2021,11918,Industrials,Consumer Electronics/Appliances
INFA,Informatica Inc. Class A Common Stock,$20.77,0.00,0.00%,5815991328.00,,2021,268881,Technology,EDP Services
INFY,Infosys Limited American Depositary Shares,$18.51,-0.10,-0.537%,77628996580.00,India,,10376665,Technology,EDP Services
ING,ING Group N.V. Common Stock,$9.92,-0.25,-2.458%,37197620033.00,Netherlands,1997,4605977,Finance,Commercial Banks
INGR,Ingredion Incorporated Common Stock,$88.16,-1.15,-1.288%,5837918173.00,United States,,475971,Consumer Staples,Farming/Seeds/Milling
INN,Summit Hotel Properties Inc. Common Stock,$7.27,0.13,1.821%,777174756.00,United States,2011,1134827,Real Estate,Real Estate Investment Trusts
INN^E,Summit Hotel Properties Inc. 6.250% Series E Cumulative Redeemable Preferred Stock,$20.12,-0.5899,-2.848%,,United States,,16688,,
INN^F,Summit Hotel Properties Inc. 5.875% Series F Cumulative Redeemable Preferred Stock $0.01 par value per share,$19.00,-0.55,-2.813%,,United States,,660,,
INSI,Insight Select Income Fund,$16.07,0.00,0.00%,172164515.00,United States,,179888,Finance,Investment Managers
INSP,Inspire Medical Systems Inc. Common Stock,$182.67,-5.12,-2.726%,5040068977.00,United States,2018,419739,Health Care,Biotechnology: Electromedical & Electrotherapeutic Apparatus
INST,Instructure Holdings Inc. Common Stock,$22.70,-0.61,-2.617%,3208580214.00,,2021,92099,Technology,Computer Software: Prepackaged Software
INSW,International Seaways Inc. Common Stock ,$21.20,0.01,0.047%,1052809744.00,,2016,357815,Technology,Semiconductors
INSW^A,International Seaways Inc. 8.50% Senior Notes due June 30 2023,$25.73,0.00,0.00%,,,,3,,
INT,World Fuel Services Corporation Common Stock,$20.46,-0.28,-1.35%,1289295350.00,United States,,559183,Energy,Oil Refining/Marketing
INVH,Invitation Homes Inc. Common Stock,$35.58,-0.06,-0.168%,21715215843.00,United States,2017,4594299,Real Estate,Real Estate Investment Trusts
IONQ,IonQ Inc. Common Stock,$4.38,-0.08,-1.794%,867855153.00,United States,2021,3176363,Industrials,Wholesale Distributors
IOT,Samsara Inc. Class A Common Stock,$11.17,-0.31,-2.70%,5687785770.00,,2021,1203196,Technology,Retail: Computer Software & Peripheral Equipment
IP,International Paper Company Common Stock,$41.83,-0.61,-1.437%,15503425250.00,United States,,3472100,Industrials,Containers/Packaging
IPG,Interpublic Group of Companies Inc. (The) Common Stock,$27.53,0.09,0.328%,10837575123.00,United States,,4314454,Consumer Discretionary,Advertising
IPI,Intrepid Potash Inc Common Stock,$45.29,-1.27,-2.728%,616789383.00,United States,2008,519144,Industrials,Major Chemicals
IPOD,Social Capital Hedosophia Holdings Corp. IV Class A Ordinary Shares,$9.93,0.00,0.00%,570975000.00,United States,2020,105518,Finance,Business Services
IPOF,Social Capital Hedosophia Holdings Corp. VI Class A Ordinary Shares,$9.93,-0.03,-0.301%,1427437500.00,United States,2020,1489672,Finance,Business Services
IPVA,InterPrivate II Acquisition Corp. Class A Common Stock,$9.79,0.01,0.102%,318603313.00,,2021,16986,Industrials,Consumer Electronics/Appliances
IPVF,InterPrivate III Financial Partners Inc. Class A Common Stock,$9.80,0.01,0.102%,325715250.00,,2021,4628,Industrials,Consumer Electronics/Appliances
IQI,Invesco Quality Municipal Income Trust Common Stock,$10.21,0.06,0.591%,539943567.00,United States,,90780,Finance,Finance Companies
IQV,IQVIA Holdings Inc. Common Stock,$216.99,2.88,1.345%,41071657805.00,United States,2013,1811578,Health Care,Managed Health Care
IR,Ingersoll Rand Inc. Common Stock,$42.08,-0.20,-0.473%,17081528972.00,United States,2017,2838887,Industrials,Industrial Machinery/Components
IRL,New Ireland Fund Inc (The) Common Stock,$7.92,-0.24,-2.941%,28828024.00,United States,1990,7026,Finance,Trusts Except Educational Religious and Charitable
IRM,Iron Mountain Incorporated (Delaware)Common Stock REIT,$48.69,0.51,1.059%,14147441285.00,United States,,1549700,Real Estate,Real Estate Investment Trusts
IRNT,IronNet Inc. Common Stock,$2.21,0.02,0.913%,223532978.00,United States,2020,453883,Technology,EDP Services
IRRX,Integrated Rail and Resources Acquisition Corp. Class A Common Stock,$9.97,0.00,0.00%,286637500.00,,2022,15,Industrials,Consumer Electronics/Appliances
IRS,IRSA Inversiones Y Representaciones S.A. Common Stock,$3.60,0.16,4.651%,291916638.00,Argentina,,47777,Real Estate,Homebuilding
IRT,Independence Realty Trust Inc. Common Stock,$20.73,-0.18,-0.861%,4584670888.00,United States,2013,1851448,Real Estate,Real Estate Investment Trusts
IS,ironSource Ltd. Class A Ordinary Shares,$2.38,-0.01,-0.418%,2430709644.00,,2021,5584597,,
ISD,PGIM High Yield Bond Fund Inc.,$12.31,0.09,0.736%,503772950.00,United States,2012,346863,Finance,Trusts Except Educational Religious and Charitable
IT,Gartner Inc. Common Stock,$241.83,1.69,0.704%,19476757978.00,United States,1993,533191,Finance,Diversified Commercial Services
ITCB,Itau CorpBanca American Depositary Shares (each representing 1500 shares of Common Stock no par value),$2.83,0.03,1.071%,1836703717.00,Chile,,13037,Finance,Commercial Banks
ITGR,Integer Holdings Corporation Common Stock,$70.66,-1.17,-1.629%,2339026183.00,United States,,160263,Health Care,Medical/Dental Instruments
ITT,ITT Inc. Common Stock ,$67.24,0.02,0.03%,5614540000.00,United States,2011,418854,Industrials,Fluid Controls
ITUB,Itau Unibanco Banco Holding SA American Depositary Shares (Each repstg 500 Preferred shares),$4.28,-0.10,-2.283%,41857931866.00,Brazil,,60478095,Finance,Commercial Banks
ITW,Illinois Tool Works Inc. Common Stock,$182.25,1.46,0.808%,56760480918.00,United States,,1486893,Industrials,Industrial Machinery/Components
IVC,Invacare Corporation Common Stock,$1.28,-0.08,-5.882%,45625043.00,United States,,256007,Health Care,Industrial Specialties
IVH,Delaware Ivy High Income Opportunities Fund,$10.24,-0.03,-0.292%,169679206.00,,2013,52429,Finance,Investment Managers
IVR,INVESCO MORTGAGE CAPITAL INC Common Stock,$14.68,0.42,2.945%,484319507.00,United States,2009,1464923,Real Estate,Real Estate Investment Trusts
IVR^B,Invesco Mortgage Capital Inc. Preferred Series B Cum Fxd to Fltg,$20.91,0.07,0.336%,,United States,,5932,,
IVR^C,INVESCO MORTGAGE CAPITAL INC 7.5% Fixed-to-Floating Series C Cumulative Redeemable Preferred Stock Liquation Preference $25.00 per Share,$20.56,-0.50,-2.374%,,United States,,20882,,
IVT,InvenTrust Properties Corp. Common Stock,$25.79,0.18,0.703%,1737954650.00,,2021,401729,Real Estate,Real Estate Investment Trusts
IVZ,Invesco Ltd Common Stock,$16.13,-0.33,-2.005%,7339560347.00,United States,,4321781,Finance,Investment Managers
IX,Orix Corp Ads Common Stock,$84.16,-1.69,-1.969%,20093561215.00,Japan,,39823,Finance,Diversified Financial Services
J,Jacobs Engineering Group Inc. Common Stock,$127.13,2.77,2.227%,16352384581.00,United States,,777502,Industrials,Oilfield Services/Equipment
JATT,JATT Acquisition Corp Class A Ordinary Shares,$9.95,0.01,0.101%,171637500.00,,2021,2288,,
JBGS,JBG SMITH Properties Common Shares ,$23.64,-0.43,-1.786%,2920677249.00,United States,2017,959380,Real Estate,Real Estate Investment Trusts
JBI,Janus International Group Inc. Common Stock,$9.03,0.04,0.445%,1323452711.00,,2021,663451,,
JBL,Jabil Inc. Common Stock,$51.21,-0.78,-1.50%,7231685852.00,United States,1993,1170537,Technology,Electrical Products
JBT,John Bean Technologies Corporation Common Stock,$110.42,0.74,0.675%,3509625829.00,United States,,499608,Industrials,Diversified Manufacture
JCE,Nuveen Core Equity Alpha Fund Nuveen Core Equity Alpha Fund Common Shares of Beneficial Interest,$13.35,0.01,0.075%,214316441.00,United States,2007,53835,Finance,Trusts Except Educational Religious and Charitable
JCI,Johnson Controls International plc Ordinary Share,$47.88,-0.80,-1.643%,33308626693.00,Switzerland,,8834732,Consumer Discretionary,Auto Parts:O.E.M.
JEF,Jefferies Financial Group Inc. Common Stock,$27.62,-0.28,-1.004%,6412055503.00,United States,,1483448,Finance,Investment Bankers/Brokers/Service
JELD,JELD-WEN Holding Inc. Common Stock,$14.59,0.10,0.69%,1270500789.00,United States,2017,896182,,
JEMD,Nuveen Emerging Markets Debt 2022 Target Term Fund Common Shares of Beneficial Interest $0.01 par value per share,$6.69,-0.0536,-0.795%,95322371.00,,2017,16504,Finance,Investment Managers
JEQ,Aberdeen Japan Equity Fund Inc.  Common Stock,$5.57,-0.02,-0.358%,74685546.00,United States,1992,10328,Finance,Finance Companies
JFR,Nuveen Floating Rate Income Fund Common Stock,$8.34,0.03,0.361%,474700023.00,United States,2004,296231,Finance,Trusts Except Educational Religious and Charitable
JGH,Nuveen Global High Income Fund Common Shares of Beneficial Interest,$11.58,0.03,0.26%,268394211.00,United States,2014,38635,Finance,Investment Managers
JHAA,Nuveen Corporate Income 2023 Target Term Fund,$8.86,-0.04,-0.449%,69339618.00,,2018,53113,Finance,Finance/Investors Services
JHG,Janus Henderson Group plc Ordinary Shares,$23.51,-0.06,-0.255%,3925169485.00,,2017,1279797,Finance,Investment Managers
JHI,John Hancock Investors Trust Common Stock,$13.18,-0.04,-0.303%,116566174.00,United States,,27895,Finance,Trusts Except Educational Religious and Charitable
JHS,John Hancock Income Securities Trust Common Stock,$11.38,0.02,0.176%,132538137.00,United States,,63248,Finance,Finance Companies
JHX,James Hardie Industries plc American Depositary Shares (Ireland),$21.94,0.24,1.106%,9772770862.00,Ireland,,69145,Industrials,Building Materials
JILL,J. Jill Inc. Common Stock,$18.29,-0.39,-2.088%,184823413.00,,2017,36207,Consumer Discretionary,Clothing/Shoe/Accessory Stores
JKS,JinkoSolar Holding Company Limited American Depositary Shares (each representing 4 Common Shares),$69.18,4.95,7.707%,3375929555.00,China,2010,1640842,Technology,Semiconductors
JLL,Jones Lang LaSalle Incorporated Common Stock,$174.86,-1.77,-1.002%,8544219502.00,United States,,675012,Finance,Real Estate
JLS,Nuveen Mortgage and Income Fund,$16.515,0.115,0.701%,90625072.00,United States,2009,6078,Finance,Investment Managers
JMIA,Jumia Technologies AG American Depositary Shares each representing two Ordinary Shares,$6.06,-0.21,-3.349%,605254990.00,,2019,2675319,Consumer Discretionary,Catalog/Specialty Distribution
JMM,Nuveen Multi-Market Income Fund (MA),$6.10,-0.02,-0.327%,57720341.00,United States,,2454,Finance,Trusts Except Educational Religious and Charitable
JNJ,Johnson & Johnson Common Stock,$177.51,0.52,0.294%,467100134228.00,United States,,10777031,Health Care,Biotechnology: Pharmaceutical Preparations
JNPR,Juniper Networks Inc. Common Stock,$28.50,-0.29,-1.007%,9208220097.00,United States,1999,3570636,Technology,Computer peripheral equipment
JOBY,Joby Aviation Inc. Common Stock,$4.91,0.22,4.691%,2977709300.00,United States,2020,4129564,Consumer Discretionary,Aerospace
JOE,St. Joe Company (The) Common Stock,$39.56,0.53,1.358%,2330578658.00,United States,,324828,Real Estate,Homebuilding
JOF,Japan Smaller Capitalization Fund Inc Common Stock,$6.32,-0.06,-0.94%,179070204.00,United States,1990,6160,Finance,Trusts Except Educational Religious and Charitable
JPC,Nuveen Preferred & Income Opportunities Fund,$7.65,-0.02,-0.261%,803779625.00,United States,2003,332666,Finance,Investment Managers
JPI,Nuveen Preferred and Income Term Fund Common Shares of Beneficial Interest,$19.21,0.03,0.156%,437458169.00,,2012,33390,Finance,Finance Companies
JPM,JP Morgan Chase & Co. Common Stock,$112.61,-2.69,-2.333%,330741252976.00,United States,,15168077,Finance,Major Banks
JPM^C,J P Morgan Chase & Co Depositary Shares each representing a 1/400th interest in a share of 6.00% Non-Cumulative  Preferred Stock Series EE,$25.54,-0.10,-0.39%,,United States,,135936,,
JPM^D,J P Morgan Chase & Co Depositary Shares each representing a 1/400th  interest in a share of 5.75% Non-Cumulative  Preferred Stock Series DD,$24.91,-0.17,-0.678%,,United States,,157029,,
JPM^J,J P Morgan Chase & Co Depositary Shares each representing a 1/400th interest in a share of JPMorgan Chase & Co. 4.75% Non-Cumulative Preferred Stock Series GG,$21.35,-0.12,-0.559%,,United States,,61914,,
JPM^K,J P Morgan Chase & Co Depositary Shares each representing a 1/400th interest in a share of 4.55% Non-Cumulative Preferred Stock Series JJ,$19.62,-0.07,-0.356%,,United States,,111853,,
JPM^L,J P Morgan Chase & Co Depositary Shares each representing a 1/400th interest in a share of 4.625% Non-Cumulative Preferred Stock Series LL,$19.86,-0.10,-0.501%,,United States,,204442,,
JPM^M,J P Morgan Chase & Co Depositary Shares each representing a 1/400th interest in a share of 4.20% Non-Cumulative Preferred Stock Series MM,$18.54,-0.19,-1.014%,,United States,,438631,,
JPS,Nuveen Preferred & Income Securities Fund,$7.26,0.03,0.415%,1493461366.00,United States,2002,606077,Finance,Investment Managers
JPT,Nuveen Preferred and Income Fund Common Shares of Beneficial Interest,$19.00,0.064,0.338%,130078579.00,United States,2017,8964,Finance,Trusts Except Educational Religious and Charitable
JQC,Nuveen Credit Strategies Income Fund Shares of Beneficial Interest,$5.20,-0.01,-0.192%,705168308.00,United States,2003,607615,Finance,Finance Companies
JRI,Nuveen Real Asset Income and Growth Fund Common Shares of Beneficial Interest,$13.07,0.02,0.153%,358819598.00,United States,2012,45966,Finance,Finance Companies
JRO,Nuveen Floating Rate Income Opportuntiy Fund Shares of Beneficial Interest,$8.17,-0.02,-0.244%,331221751.00,United States,2004,80370,Finance,Investment Managers
JRS,Nuveen Real Estate Income Fund Common Shares of Beneficial Interest,$9.40,-0.07,-0.739%,271589227.00,United States,2001,124402,Finance,Finance/Investors Services
JSD,Nuveen Short Duration Credit Opportunities Fund Common Shares of Beneficial Interest,$12.03,-0.11,-0.906%,121330345.00,United States,2011,21465,Finance,Finance Companies
JT,Jianpu Technology Inc. American depositary shares,$1.68,-0.01,-0.592%,35588908.00,,2017,126148,Technology,EDP Services
JUN,Juniper II Corp. Class A Common Stock,$9.93,0.00,0.00%,371133750.00,,2021,43978,Industrials,Consumer Electronics/Appliances
JWN,Nordstrom Inc. Common Stock,$21.13,-1.05,-4.734%,3393036869.00,United States,,4551153,Consumer Discretionary,Clothing/Shoe/Accessory Stores
JWSM,Jaws Mustang Acquisition Corp. Class A Ordinary Shares,$9.83,-0.02,-0.203%,1271756250.00,,2021,894484,Finance,Business Services
JXN,Jackson Financial Inc. Class A Common Stock ,$26.75,-0.26,-0.963%,2308518420.00,,2021,1402206,Finance,Finance/Investors Services
K,Kellogg Company Common Stock,$71.34,-0.28,-0.391%,24103830071.00,United States,,2697442,Consumer Staples,Packaged Foods
KAHC,KKR Acquisition Holdings I Corp. Class A Common Stock,$9.79,-0.005,-0.051%,1688775000.00,,2021,33756,Industrials,Consumer Electronics/Appliances
KAI,Kadant Inc Common Stock,$182.35,1.33,0.735%,2126086667.00,United States,1992,38170,Technology,Industrial Machinery/Components
KAMN,Kaman Corporation Common Stock,$31.25,0.33,1.067%,874297094.00,United States,,237521,Industrials,Military/Government/Technical
KAR,KAR Auction Services Inc Common Stock,$14.77,-0.44,-2.893%,1795037876.00,United States,2009,854424,,
KB,KB Financial Group Inc,$37.20,0.09,0.243%,13110996259.00,South Korea,,284832,Finance,Commercial Banks
KBH,KB Home Common Stock,$28.46,0.32,1.137%,2480736448.00,United States,1986,1403173,,
KBR,KBR Inc. Common Stock,$48.39,0.51,1.065%,6753309561.00,United States,2006,1524725,Industrials,Oilfield Services/Equipment
KCGI,Kensington Capital Acquisition Corp. V Class A Ordinary Shares,$9.89,-0.01,-0.101%,341205000.00,,2021,54457,,
KD,Kyndryl Holdings Inc. Common Stock,$9.78,-0.15,-1.511%,2207957142.00,,2021,3181554,Technology,EDP Services
KEN,Kenon Holdings Ltd. Ordinary Shares,$39.84,-2.27,-5.391%,2146755930.00,Singapore,2015,73344,Utilities,Electric Utilities: Central
KEP,Korea Electric Power Corporation Common Stock,$8.78,0.18,2.093%,11272889192.00,South Korea,1994,208629,Industrials,Electrical Products
KEX,Kirby Corporation Common Stock,$60.84,-0.14,-0.23%,3668652000.00,United States,,358938,Consumer Discretionary,Marine Transportation
KEY,KeyCorp Common Stock,$17.23,-0.26,-1.487%,16066473073.00,United States,,10531137,Finance,Major Banks
KEY^I,KeyCorp Depositary Shares Each Representing a 1/40th Ownership Interest in a Share of Fixed-to-Floating Rate Perpetual Non-Cumulative Preferred Stock Series E,$25.17,-0.27,-1.061%,,United States,,58360,,
KEY^J,KeyCorp Depositary Shares each representing a 1/40th ownership interest in a share of Fixed Rate Perpetual Non-Cumulative Preferred Stock Series F,$23.52,0.29,1.248%,,United States,,24182,,
KEY^K,KeyCorp Depositary Shares each representing a 1/40th ownership interest in a share of Fixed Rate Perpetual Non-Cumulative Preferred Stock Series G,$24.48,0.23,0.948%,,United States,,13187,,
KEYS,Keysight Technologies Inc. Common Stock,$137.85,-0.83,-0.599%,24805544245.00,United States,2014,813223,Industrials,Industrial Machinery/Components
KF,Korea Fund Inc. (The) New Common Stock,$24.3466,0.0166,0.068%,122729969.00,United States,,2673,Finance,Investment Managers
KFS,Kingsway Financial Services Inc. Common Stock (DE),$5.70,0.04,0.707%,137571598.00,Canada,,44741,,
KFY,Korn Ferry Common Stock,$58.02,0.28,0.485%,3086083800.00,United States,1999,284256,Consumer Discretionary,Diversified Commercial Services
KGC,Kinross Gold Corporation Common Stock,$3.58,-0.17,-4.533%,4651136000.00,Canada,2001,18852858,,
KIM,Kimco Realty Corporation Common Stock,$19.77,-0.41,-2.032%,12217994713.00,United States,,5661936,Real Estate,Real Estate Investment Trusts
KIM^L,Kimco Realty Corporation Class L Depositary Shares each of which represents a one-one thousandth fractional interest in a share of 5.125% Class L Cumulative Redeemable Preferred Stock liquidation preference $25000.00 per share,$24.15,-0.46,-1.869%,,United States,,19988,,
KIM^M,Kimco Realty Corporation Class M Depositary Shares each of which represents a one-one thousandth fractional interest in a share of 5.25% Class M Cumulative Redeemable Preferred Stock liquidation preference $25000.00 per share,$23.885,-0.375,-1.546%,,United States,,36468,,
KIND,Nextdoor Holdings Inc. Class A Common Stock,$3.31,0.03,0.915%,1279063341.00,United States,,2466507,Consumer Discretionary,EDP Services
KIO,KKR Income Opportunities Fund Common Shares,$11.64,0.07,0.605%,236761267.00,,2013,115417,Finance,Investment Managers
KKR,KKR & Co. Inc. Common Stock,$46.29,-1.06,-2.239%,27431789649.00,United States,,2551578,Finance,Investment Managers
KKR^C,KKR & Co. Inc. 6.00% Series C Mandatory Convertible Preferred Stock,$58.47,-1.48,-2.469%,,United States,,202582,,
KKRS,KKR Group Finance Co. IX LLC 4.625% Subordinated Notes due 2061,$18.65,-0.03,-0.161%,0.00,,2021,36424,,
