Symbol,Name,Last Sale,Net Change,% Change,Market Cap,Country,IPO Year,Volume,Sector,Industry
CRK,Comstock Resources Inc. Common Stock,$12.08,-1.40,-10.386%,2813502885.00,United States,,5180241,Energy,Oil & Gas Production
CRL,Charles River Laboratories International Inc. Common Stock,$213.97,-5.49,-2.502%,10870715894.00,United States,2000,596926,Consumer Discretionary,EDP Services
CRM,Salesforce Inc. Common Stock,$165.04,-5.57,-3.265%,164214800000.00,United States,2004,9534730,Technology,Computer Software: Prepackaged Software
CRS,Carpenter Technology Corporation Common Stock,$27.91,0.20,0.722%,1347454721.00,United States,,447515,Industrials,Steel/Iron Ore
CRT,Cross Timbers Royalty Trust Common Stock,$15.18,-1.57,-9.373%,91080000.00,United States,1992,111460,Energy,Oil & Gas Production
CRU,Crucible Acquisition Corporation Class A Common Stock,$9.84,0.00,0.00%,318262500.00,,2021,32244,Industrials,Consumer Electronics/Appliances
CS,Credit Suisse Group American Depositary Shares,$5.67,-0.12,-2.073%,14493106669.00,Switzerland,,17285123,Finance,Investment Bankers/Brokers/Service
CSAN,Cosan S.A. ADS,$13.90,-0.30,-2.113%,6493446104.00,,2021,198620,Consumer Discretionary,Retail-Auto Dealers and Gas Stations
CSL,Carlisle Companies Incorporated Common Stock,$238.61,-1.11,-0.463%,12335769779.00,United States,,402488,,
CSR,D/B/A Centerspace Common Stock,$81.55,1.27,1.582%,1253037932.00,United States,,65931,Real Estate,Real Estate Investment Trusts
CSR^C,D/B/A Centerspace 6.625% Series C ,$25.78,0.06,0.233%,,United States,,7364,,
CSTA,Constellation Acquisition Corp I Class A Ordinary Shares,$9.83,0.01,0.102%,380912500.00,,2021,25156,Finance,Business Services
CSTM,Constellium SE Ordinary Shares (France),$13.21,-0.21,-1.565%,1871558005.00,Netherlands,2013,789778,Industrials,Aluminum
CSV,Carriage Services Inc. Common Stock,$39.65,0.64,1.641%,590350951.00,United States,,155015,Consumer Discretionary,Other Consumer Services
CTA^A,E.I. du Pont de Nemours and Company Preferred Stock,$76.9758,0.00,0.00%,,United States,,53,,
CTA^B,E.I. du Pont de Nemours and Company Preferred Stock,$113.10,1.10,0.982%,,United States,,6467,,
CTBB,Qwest Corporation 6.5% Notes due 2056,$23.03,-0.193,-0.831%,0.00,United States,2016,66585,,
CTDD,Qwest Corporation 6.75% Notes due 2057,$24.04,-0.11,-0.455%,0.00,United States,2017,35911,,
CTLT,Catalent Inc. Common Stock,$107.29,1.14,1.074%,19227788198.00,United States,2014,1362339,Health Care,Biotechnology: Pharmaceutical Preparations
CTO,CTO Realty Growth Inc. Common Stock,$61.12,0.48,0.792%,368819778.00,United States,1992,37367,Real Estate,Real Estate Investment Trusts
CTO^A,CTO Realty Growth Inc. 6.375% Series A Cumulative Redeemable Preferred Stock,$22.98,0.78,3.514%,,United States,,866,,
CTOS,Custom Truck One Source Inc. Common Stock,$5.60,0.30,5.66%,1386503563.00,Cayman Islands,2017,776806,Consumer Discretionary,Diversified Commercial Services
CTR,ClearBridge MLP and Midstream Total Return Fund Inc. Common Stock,$25.61,-0.39,-1.50%,181052456.00,United States,2012,51172,Finance,Investment Managers
CTRA,Coterra Energy Inc. Common Stock,$25.79,-0.92,-3.444%,20781715051.00,United States,,12044250,Energy,Oil & Gas Production
CTRE,CareTrust REIT Inc. Common Stock,$18.44,-0.29,-1.548%,1789210002.00,United States,,683244,Real Estate,Real Estate Investment Trusts
CTS,CTS Corporation Common Stock,$34.05,0.40,1.189%,1092610769.00,United States,,144882,Technology,Industrial Machinery/Components
CTT,CatchMark Timber Trust Inc. Class A Common Stock,$10.06,-0.01,-0.099%,495431470.00,United States,2013,480157,Real Estate,Real Estate Investment Trusts
CTV,Innovid Corp. Common Stock,$1.66,-0.03,-1.775%,219272073.00,,2021,216818,Consumer Discretionary,Advertising
CTVA,Corteva Inc. Common Stock ,$54.14,-0.39,-0.715%,39181118000.00,,2019,3588062,Industrials,Major Chemicals
CUBB,Customers Bancorp Inc 5.375% Subordinated Notes Due 2034,$23.30,0.30,1.304%,0.00,United States,2019,358,Finance,Major Banks
CUBE,CubeSmart Common Shares,$42.72,-0.63,-1.453%,9587984311.00,United States,,1344397,Real Estate,Real Estate Investment Trusts
CUBI,Customers Bancorp Inc Common Stock,$33.90,-0.95,-2.726%,1118062816.00,United States,,593368,Finance,Major Banks
CUBI^E,Customers Bancorp Inc Fixed-to-Floating Rate Non-Cumulative Perpetual Preferred Stock Series E,$25.63,0.0308,0.12%,,United States,,4118,,
CUBI^F,Customers Bancorp Inc Fixed-to-Floating Rate Non-Cumulative Perpetual Preferred Stock Series F,$24.50,0.10,0.41%,,United States,,6041,,
CUK,Carnival Plc ADS ADS,$7.90,-0.22,-2.709%,9289512482.00,United States,,4835287,Consumer Discretionary,Marine Transportation
CULP,Culp Inc. Common Stock,$4.30,-0.73,-14.513%,52537688.00,United States,,311760,Consumer Discretionary,Textiles
CURO,CURO Group Holdings Corp. Common Stock,$5.53,-0.21,-3.659%,223130407.00,,2017,104504,Finance,Diversified Financial Services
CURV,Torrid Holdings Inc. Common Stock,$4.32,-0.22,-4.846%,447870967.00,,2021,500264,Consumer Discretionary,Clothing/Shoe/Accessory Stores
CUZ,Cousins Properties Incorporated Common Stock,$29.23,-0.53,-1.781%,4348362805.00,United States,,1320822,Real Estate,Real Estate Investment Trusts
CVE,Cenovus Energy Inc Common Stock,$19.01,-0.36,-1.859%,37671261550.00,Canada,,9276582,,
CVEO,Civeo Corporation (Canada) Common Shares,$25.87,-0.38,-1.448%,366435537.00,,2014,50194,,
CVI,CVR Energy Inc. Common Stock,$33.50,-1.61,-4.586%,3367775067.00,United States,2007,912342,Energy,Integrated oil Companies
CVII,Churchill Capital Corp VII Class A Common Stock,$9.77,-0.01,-0.102%,1685325000.00,,2021,72286,Industrials,Consumer Electronics/Appliances
CVNA,Carvana Co. Class A Common Stock,$22.58,-0.53,-2.293%,2387696788.00,United States,2017,12350252,Consumer Discretionary,Other Specialty Stores
CVS,CVS Health Corporation Common Stock,$92.66,-0.69,-0.739%,121505898797.00,United States,,6336203,Health Care,Managed Health Care
CVX,Chevron Corporation Common Stock,$144.78,-2.20,-1.497%,284465692160.00,United States,,10681552,Energy,Integrated oil Companies
CW,Curtiss-Wright Corporation Common Stock,$132.06,1.97,1.514%,5077103618.00,United States,,114209,Industrials,Industrial Machinery/Components
CWAN,Clearwater Analytics Holdings Inc. Class A Common Stock,$12.04,-0.33,-2.668%,2234465662.00,,2021,349192,Technology,Computer Software: Prepackaged Software
CWEN,Clearway Energy Inc. Class C Common Stock,$34.84,0.31,0.898%,4060388919.00,United States,2015,440461,Utilities,Electric Utilities: Central
CWH,Camping World Holdings Inc. Class A Commom Stock,$21.59,-0.17,-0.781%,900088978.00,United States,2016,815856,Consumer Discretionary,Other Specialty Stores
CWK,Cushman & Wakefield plc Ordinary Shares,$15.24,0.21,1.397%,3437087975.00,,2018,1438864,Finance,Real Estate
CWT,California Water Service Group Common Stock,$55.55,1.20,2.208%,2987090150.00,United States,,281115,Utilities,Water Supply
CX,Cemex S.A.B. de C.V. Sponsored ADR,$3.92,0.05,1.292%,5773756522.00,Mexico,,10416253,Industrials,Building Materials
CXAC,C5 Acquisition Corporation Class A Common Stock,$9.99,0.025,0.251%,359015625.00,,2022,14600,Industrials,Consumer Electronics/Appliances
CXE,MFS High Income Municipal Trust Common Stock,$3.76,0.05,1.348%,118536906.00,United States,1989,169034,Finance,Investment Managers
CXH,MFS Investment Grade Municipal Trust Common Stock,$7.58,0.03,0.397%,69055657.00,United States,1989,19717,Finance,Investment Managers
CXM,Sprinklr Inc. Class A Common Stock,$10.11,-0.29,-2.788%,2609892527.00,,2021,893737,Technology,Computer Software: Prepackaged Software
CXW,CoreCivic Inc. Common Stock,$11.11,-0.17,-1.507%,1319793663.00,United States,,967516,Real Estate,Real Estate Investment Trusts
CYD,China Yuchai International Limited Common Stock,$8.82,-0.47,-5.059%,360370118.00,Singapore,1994,63896,Industrials,Construction/Ag Equipment/Trucks
CYH,Community Health Systems Inc. Common Stock,$3.75,-0.24,-6.015%,505103621.00,United States,2000,2715631,Health Care,Hospital/Nursing Management
CZOO,Cazoo Group Ltd Class A Ordinary Shares,$0.72,-0.0617,-7.893%,547828183.00,,,7342072,Consumer Discretionary,Retail-Auto Dealers and Gas Stations
D,Dominion Energy Inc. Common Stock,$79.81,0.79,1.00%,64747486953.00,United States,,3498029,Utilities,Electric Utilities: Central
DAC,Danaos Corporation Common Stock,$63.10,0.00,0.00%,1307213611.00,Greece,2006,241488,Consumer Discretionary,Marine Transportation
DAL,Delta Air Lines Inc. Common Stock,$28.97,-0.67,-2.26%,18571450695.00,United States,,16384424,Consumer Discretionary,Air Freight/Delivery Services
DAN,Dana Incorporated Common Stock ,$14.07,-0.58,-3.959%,2037571349.00,United States,,2004729,Consumer Discretionary,Auto Parts:O.E.M.
DAO,Youdao Inc. American Depositary Shares each representing one Class A Ordinary Share,$4.92,-0.35,-6.641%,609986304.00,,2019,252818,Real Estate,Other Consumer Services
DAR,Darling Ingredients Inc. Common Stock,$59.80,-3.65,-5.753%,9658541147.00,United States,1997,3818629,Consumer Staples,Farming/Seeds/Milling
DASH,DoorDash Inc. Class A Common Stock,$64.17,-3.25,-4.821%,22539703324.00,,2020,5379351,Industrials,Industrial Machinery/Components
DAVA,Endava plc American Depositary Shares (each representing one Class A Ordinary Share),$88.27,-5.04,-5.401%,4942598942.00,United States,2018,266477,Technology,EDP Services
DB,Deutsche Bank AG Common Stock,$8.74,-0.23,-2.564%,18063597165.00,Germany,,5274773,Finance,Commercial Banks
DBD,Diebold Nixdorf Incorporated Common Stock,$2.27,-0.01,-0.439%,179258895.00,United States,,1222110,Technology,EDP Services
DBI,Designer Brands Inc. Class A Common Stock,$13.06,-0.28,-2.099%,918813785.00,United States,,1523710,Consumer Discretionary,Clothing/Shoe/Accessory Stores
DBL,DoubleLine Opportunistic Credit Fund Common Shares of Beneficial Interest,$15.58,0.2299,1.498%,243824476.00,United States,2012,60018,,
DBRG,DigitalBridge Group Inc.,$4.88,0.20,4.274%,3198719854.00,United States,2014,6433105,Real Estate,Real Estate Investment Trusts
DBRG^H,DigitalBridge Group Inc. 7.125% Series H ,$21.6185,0.0685,0.318%,,United States,,43274,,
DBRG^I,DigitalBridge Group Inc. 7.15% Series I ,$21.50,-0.05,-0.232%,,United States,,34637,,
DBRG^J,DigitalBridge Group Inc. 7.125% Series J ,$21.55,0.00,0.00%,,United States,,45877,,
DCF,BNY Mellon Alcentra Global Credit Income 2024 Target Term Fund Inc. Common Stock,$7.38,0.00,0.00%,110551278.00,,2017,24973,Finance,Finance/Investors Services
DCI,Donaldson Company Inc. Common Stock,$48.14,0.03,0.062%,5914751284.00,United States,,407906,Industrials,Pollution Control Equipment
DCO,Ducommun Incorporated Common Stock,$43.04,1.50,3.611%,517912242.00,United States,,72055,Industrials,Military/Government/Technical
DCP,DCP Midstream  LP Common Units ,$29.58,-0.03,-0.101%,6163981238.00,United States,,692066,Utilities,Natural Gas Distribution
DCP^B,DCP Midstream LP 7.875% Series B Fixed-to-Floating Rate Cumulative Redeemable Perpetual Preferred Units,$22.22,0.045,0.203%,,United States,,137943,,
DCP^C,DCP Midstream LP 7.95% Series C Fixed-to-Floating Rate Cumulative Redeemable Perpetual Preferred Units,$25.15,-0.775,-2.989%,,United States,,49054,,
DD,DuPont de Nemours Inc. Common Stock,$55.58,-0.75,-1.331%,28263905593.00,,2017,2465959,Consumer Discretionary,Wholesale Distributors
DDD,3D Systems Corporation Common Stock,$9.70,-0.07,-0.716%,1264278164.00,United States,,944240,Technology,Computer peripheral equipment
DDF,Delaware Investments Dividend & Income Fund Inc. Common Stock,$8.48,-0.15,-1.738%,64542620.00,United States,1993,74221,Finance,Finance/Investors Services
DDL,Dingdong (Cayman) Limited American Depositary Shares (each two representing three Ordinary Shares),$5.53,0.21,3.947%,1196686039.00,,2021,951553,,
DDS,Dillard's Inc. Common Stock,$220.57,-17.46,-7.335%,3865106340.00,United States,,329072,Consumer Discretionary,Department/Specialty Retail Stores
DDT,Dillard's Capital Trust I,$26.32,-0.28,-1.053%,0.00,United States,,5738,Consumer Discretionary,Department/Specialty Retail Stores
DE,Deere & Company Common Stock,$299.47,-1.18,-0.392%,91528714694.00,United States,,2079370,Industrials,Industrial Machinery/Components
DEA,Easterly Government Properties Inc. Common Stock,$19.04,-0.09,-0.47%,1728449239.00,United States,2015,528803,Real Estate,Real Estate Investment Trusts
DECK,Deckers Outdoor Corporation Common Stock,$255.35,-4.89,-1.879%,6840791006.00,United States,1993,261196,Consumer Discretionary,Shoe Manufacturing
DEI,Douglas Emmett Inc. Common Stock,$22.38,-0.18,-0.798%,3934048986.00,United States,2006,1477404,Real Estate,Real Estate Investment Trusts
DELL,Dell Technologies Inc. Class C Common Stock ,$46.21,-1.18,-2.49%,34173108296.00,,2018,3976949,Technology,Computer Manufacturing
DEN,Denbury Inc. Common Stock,$59.99,-1.22,-1.993%,3021637690.00,,2020,625481,Energy,Oil & Gas Production
DEO,Diageo plc Common Stock,$174.12,-1.05,-0.599%,99412849549.00,United Kingdom,,748951,Consumer Staples,Beverages (Production/Distribution)
DESP,Despegar.com Corp. Ordinary Shares,$8.10,-0.35,-4.142%,536525313.00,,2017,504387,Consumer Discretionary,Other Consumer Services
DEX,Delaware Enhanced Global Dividend Common Shares of Beneficial Interest,$7.61,-0.36,-4.517%,85360632.00,United States,2007,17608,Finance,Finance Companies
DFIN,Donnelley Financial Solutions Inc. Common Stock ,$29.29,0.00,0.00%,931116886.00,,2016,198898,Finance,Investment Managers
DFP,Flaherty & Crumrine Dynamic Preferred and Income Fund Inc. Common Stock,$21.49,0.19,0.892%,432730376.00,,2013,57129,Finance,Investment Managers
DFS,Discover Financial Services Common Stock,$94.58,-1.01,-1.057%,26573678780.00,United States,,1671450,Finance,Finance: Consumer Services
DG,Dollar General Corporation Common Stock,$245.44,-1.61,-0.652%,55714148098.00,United States,2009,1510350,Consumer Discretionary,Department/Specialty Retail Stores
DGX,Quest Diagnostics Incorporated Common Stock,$132.98,-4.63,-3.365%,15607201423.00,United States,,1245435,Health Care,Medical Specialities
DHF,BNY Mellon High Yield Strategies Fund Common Stock,$2.27,0.02,0.889%,165111932.00,United States,1998,358768,Finance,Finance Companies
DHI,D.R. Horton Inc. Common Stock,$66.19,0.18,0.273%,23300882314.00,United States,,2843210,,
DHR,Danaher Corporation Common Stock,$253.52,0.66,0.261%,184328501716.00,United States,,2172075,Health Care,Medical Specialities
DHR^B,Danaher Corporation 5.00% Mandatory Convertible Preferred Stock Series B,$1323.21,-5.88,-0.442%,,United States,,33801,,
DHT,DHT Holdings Inc.,$6.13,-0.13,-2.077%,1022479911.00,Jersey,2005,1928393,Consumer Discretionary,Marine Transportation
DHX,DHI Group Inc. Common Stock,$4.97,-0.01,-0.201%,235251600.00,United States,2007,491817,Consumer Discretionary,Diversified Commercial Services
DIAX,Nuveen Dow 30SM Dynamic Overwrite Fund Common Shares of Beneficial Interest,$15.28,0.01,0.065%,555686446.00,,2014,339222,Finance,Finance Companies
DIN,Dine Brands Global Inc. Common Stock,$65.08,-0.07,-0.107%,1090155861.00,United States,,211174,Consumer Discretionary,Restaurants
DINO,HF Sinclair Corporation Common Stock,$45.16,-1.05,-2.272%,10081054652.00,United States,1960,2853552,Energy,Integrated oil Companies
DIS,Walt Disney Company (The) Common Stock,$94.40,-1.25,-1.307%,171948065245.00,United States,,10977557,Consumer Discretionary,Movies/Entertainment
DK,Delek US Holdings Inc. Common Stock,$25.84,-0.91,-3.402%,1828052996.00,United States,2017,2079483,Energy,Integrated oil Companies
DKL,Delek Logistics Partners L.P. Common Units representing Limited Partner Interests,$48.70,-1.03,-2.071%,2117173183.00,United States,2012,33599,Energy,Oil & Gas Production
DKS,Dick's Sporting Goods Inc Common Stock,$75.37,-1.11,-1.451%,6069341470.00,United States,2002,1979673,Consumer Discretionary,Other Specialty Stores
DLB,Dolby Laboratories Common Stock,$71.56,-1.13,-1.555%,7220016431.00,United States,2005,343068,Technology,EDP Services
DLNG,Dynagas LNG Partners LP Common Units,$3.31,-0.13,-3.779%,121815438.00,Greece,,89097,,
DLNG^A,Dynagas LNG Partners LP 9.00% Series A Cumulative Redeemable Preferred Units,$23.06,-0.11,-0.475%,,Greece,,41846,,
DLNG^B,Dynagas LNG Partners LP 8.75% Series B Fixed to Floating Rate Cumulative Redeemable Perpetual Preferred Units liquidation preference $25.00 per Uni,$25.10,-0.05,-0.199%,,Greece,,23003,,
DLR,Digital Realty Trust Inc. Common Stock,$129.83,2.43,1.907%,36959012758.00,United States,2004,3313915,Real Estate,Real Estate Investment Trusts
DLR^J,Digital Realty Trust Inc. 5.250% Series J Cumulative Redeemable Preferred Stock,$24.25,0.25,1.042%,,United States,,188017,,
DLR^K,Digital Realty Trust Inc. 5.850% Series K Cumulative Redeemable Preferred Stock par value $0.01 per share,$25.07,-0.27,-1.066%,,United States,,10290,,
DLR^L,Digital Realty Trust Inc. 5.200% Series L Cumulative Redeemable Preferred Stock,$23.79,0.09,0.38%,,United States,,17878,,
DLX,Deluxe Corporation Common Stock,$21.67,0.02,0.092%,931605457.00,United States,,287798,Consumer Discretionary,Advertising
DLY,DoubleLine Yield Opportunities Fund Common Shares of Beneficial Interest,$14.34,0.03,0.21%,687542471.00,,2020,236235,Finance,Investment Managers
DM,Desktop Metal Inc. Class A Common Stock,$2.20,0.05,2.326%,689614904.00,,2019,8103701,Technology,Computer peripheral equipment
DMA,Destra Multi-Alternative Fund Common Stock,$6.85,-0.20,-2.837%,61398187.00,,2022,33856,Finance,Trusts Except Educational Religious and Charitable
DMB,BNY Mellon Municipal Bond Infrastructure Fund Inc. Common Stock,$13.01,-0.26,-1.959%,239370925.00,,2013,78060,Finance,Trusts Except Educational Religious and Charitable
DMO,Western Asset Mortgage Opportunity Fund Inc. Common Stock,$11.68,0.11,0.951%,133914132.00,United States,2010,16795,Finance,Trusts Except Educational Religious and Charitable
DMS,Digital Media Solutions Inc. Class A Ordinary Shares,$1.11,0.04,3.738%,40407554.00,United States,2018,50079,Consumer Discretionary,Advertising
DMYS,dMY Technology Group Inc. VI Class A Common Stock,$9.78,0.02,0.205%,295233750.00,,2021,69217,Industrials,Consumer Electronics/Appliances
DNA,Ginkgo Bioworks Holdings Inc. Class A Common Stock,$2.38,-0.12,-4.80%,4228395920.00,United States,2021,22617566,Health Care,Biotechnology: Biological Products (No Diagnostic Substances)
DNB,Dun & Bradstreet Holdings Inc. Common Stock,$15.03,0.00,0.00%,6524243728.00,United States,2020,830508,Technology,Internet and Information Services
DNMR,Danimer Scientific Inc. Common Stock,$4.56,-0.55,-10.763%,461083766.00,,2020,2124101,Industrials,Plastic Products
DNOW,NOW Inc. Common Stock,$9.78,0.15,1.558%,1082729267.00,,2014,1057790,Industrials,Metal Fabrications
DNP,DNP Select Income Fund Inc. Common Stock,$10.84,0.07,0.65%,3779474660.00,United States,1987,438993,Finance,Investment Managers
DNZ,D and Z Media Acquisition Corp. Class A Common Stock,$9.81,0.01,0.102%,352546875.00,,2021,13467,Industrials,Consumer Electronics/Appliances
DO,Diamond Offshore Drilling Inc. Common Stock,$5.89,-0.42,-6.656%,589441444.00,United States,2022,2109143,Energy,Oil & Gas Production
DOC,Physicians Realty Trust Common Shares of Beneficial Interest,$17.45,-0.20,-1.133%,3931416753.00,United States,2013,1965990,Real Estate,Real Estate Investment Trusts
DOCN,DigitalOcean Holdings Inc. Common Stock,$41.36,-1.88,-4.348%,4222856000.00,United States,2021,1906406,Technology,Retail: Computer Software & Peripheral Equipment
DOCS,Doximity Inc. Class A Common Stock,$34.82,-2.71,-7.221%,6737297426.00,,2021,2486453,Technology,Retail: Computer Software & Peripheral Equipment
DOLE,Dole plc Ordinary Shares,$8.46,-0.24,-2.759%,802665393.00,,2021,757007,Consumer Staples,Farming/Seeds/Milling
DOMA,Doma Holdings Inc. Common Stock,$1.03,0.1075,11.653%,334451322.00,,2021,2414884,Finance,Real Estate
DOOR,Masonite International Corporation Ordinary Shares (Canada),$76.83,1.14,1.506%,1733665569.00,Canada,,77648,,
DOUG,Douglas Elliman Inc. Common Stock,$4.79,0.06,1.268%,389118649.00,,2021,267348,Real Estate,Building operators
DOV,Dover Corporation Common Stock,$121.32,0.06,0.049%,17489906600.00,United States,,1191449,Industrials,Industrial Machinery/Components
DOW,Dow Inc. Common Stock ,$51.61,-0.37,-0.712%,37577336066.00,,2019,5847616,Industrials,Industrial Specialties
DPG,Duff & Phelps Utility and Infrastructure Fund Inc.,$13.90,0.22,1.608%,528896918.00,United States,2011,190020,Finance,Trusts Except Educational Religious and Charitable
DPZ,Domino's Pizza Inc Common Stock,$389.71,0.67,0.172%,14047123061.00,United States,2004,551064,Consumer Discretionary,Food Distributors
DQ,DAQO New Energy Corp. American Depositary Shares each representing five ordinary shares,$71.38,4.21,6.268%,5318304663.00,China,2010,2957694,Technology,Semiconductors
DRD,DRDGOLD Limited American Depositary Shares,$5.87,-0.21,-3.454%,503632170.00,South Africa,,264514,Basic Materials,Precious Metals
DRE,Duke Realty Corporation Common Stock,$54.95,-0.40,-0.723%,21145877793.00,United States,,3715913,Real Estate,Real Estate Investment Trusts
DRH,Diamondrock Hospitality Company Common Stock,$8.21,0.02,0.244%,1731169672.00,United States,2005,2814398,Real Estate,Real Estate Investment Trusts
DRH^A,Diamondrock Hospitality Company 8.250% Series A Cumulative Redeemable Preferred Stock,$25.65,-0.16,-0.62%,,United States,,37117,,
DRI,Darden Restaurants Inc. Common Stock,$113.12,-0.75,-0.659%,14109948541.00,United States,,1641623,Consumer Discretionary,Restaurants
DRQ,Dril-Quip Inc. Common Stock,$25.80,0.39,1.535%,890586536.00,United States,1997,306749,Industrials,Metal Fabrications
DS,Drive Shack Inc.,$1.37,-0.03,-2.143%,126567476.00,United States,,702713,Consumer Discretionary,Movies/Entertainment
DS^B,Drive Shack Inc. Preferred Series B,$21.80,-0.40,-1.802%,,United States,,1611,,
DS^C,Drive Shack Inc. Preferred Series C,$19.493,0.00,0.00%,,United States,,1,,
DS^D,Drive Shack Inc. Pfd Ser D,$19.36,0.28,1.468%,,United States,,600,,
DSAQ,Direct Selling Acquisition Corp. Class A Common Stock,$10.02,0.00,0.00%,288075000.00,,2021,14794,Industrials,Consumer Electronics/Appliances
DSL,DoubleLine Income Solutions Fund Common Shares of Beneficial Interests,$12.13,0.08,0.664%,1237221524.00,,2013,831112,Finance,Trusts Except Educational Religious and Charitable
DSM,BNY Mellon Strategic Municipal Bond Fund Inc. Common Stock,$6.22,-0.03,-0.48%,307446458.00,United States,1989,246836,Finance,Investment Managers
DSU,Blackrock Debt Strategies Fund Inc. Common Stock,$9.14,0.03,0.329%,426018252.00,United States,1998,187088,Finance,Finance Companies
DSX,Diana Shipping inc. common stock,$4.79,0.03,0.63%,412621416.00,Greece,2005,884949,Consumer Discretionary,Marine Transportation
DSX^B,Diana Shipping Inc. Perpetual Preferred Shares Series B (Marshall Islands),$26.01,0.06,0.231%,,Greece,,1299,,
DT,Dynatrace Inc. Common Stock,$39.44,-2.07,-4.987%,11313088945.00,United States,2019,5628504,Technology,EDP Services
DTB,DTE Energy Company 2020 Series G 4.375% Junior Subordinated Debentures due 2080,$19.47,0.06,0.309%,0.00,United States,2020,5084,Utilities,Electric Utilities: Central
DTC,Solo Brands Inc. Class A Common Stock,$4.06,-0.21,-4.918%,257407134.00,,2021,369547,Miscellaneous,Diversified Commercial Services
DTE,DTE Energy Company Common Stock,$126.75,0.70,0.555%,24556439291.00,United States,,1222066,Utilities,Electric Utilities: Central
DTF,DTF Tax-Free Income 2028 Term Fund Inc. Common Stock,$11.84,0.06,0.509%,83230073.00,United States,1991,23504,Finance,Investment Managers
DTG,DTE Energy Company 2021 Series E 4.375% Junior Subordinated Debentures,$18.98,-0.07,-0.367%,0.00,United States,2021,51727,Utilities,Electric Utilities: Central
DTLA^,Brookfield DTLA Inc. 7.625% Series A Cumulative Redeemable Preferred Stock,$8.75,-0.44,-4.788%,,,,31679,,
DTM,DT Midstream Inc. Common Stock ,$49.02,-0.32,-0.649%,4741901856.00,,2021,448198,Utilities,Oil & Gas Production
DTP,DTE Energy Company 6.25% Corporate Units,$51.42,0.08,0.156%,0.00,United States,,57715,Utilities,Electric Utilities: Central
DTW,DTE Energy Company 2017 Series E 5.25% Junior Subordinated Debentures due 2077,$23.80,0.02,0.084%,0.00,United States,2017,7406,Utilities,Electric Utilities: Central
DUK,Duke Energy Corporation (Holding Company) Common Stock,$107.21,1.20,1.132%,82541030675.00,United States,,3568851,Utilities,Power Generation
DUK^A,Duke Energy Corporation Depositary Shares each representing a 1/1000th interest in a share of 5.75% Series A Cumulative Redeemable Perpetual Preferred Stock,$25.21,-0.04,-0.158%,,United States,,28649,,
DUKB,Duke Energy Corporation 5.625% Junior Subordinated Debentures due 2078,$25.20,-0.13,-0.513%,0.00,United States,2018,13180,Utilities,Power Generation
DV,DoubleVerify Holdings Inc. Common Stock,$22.67,0.38,1.705%,3706619698.00,,2021,645429,Technology,Computer Software: Prepackaged Software
DVA,DaVita Inc. Common Stock,$79.96,-1.50,-1.841%,7564216000.00,United States,,844962,Health Care,Medical/Nursing Services
DVN,Devon Energy Corporation Common Stock,$55.11,-0.71,-1.272%,36372600000.00,United States,1985,11846093,Energy,Oil & Gas Production
DWIN,Delwinds Insurance Acquisition Corp. Class A Common Stock,$10.02,0.00,0.00%,161119877.00,,2021,725,Industrials,Consumer Electronics/Appliances
DX,Dynex Capital Inc. Common Stock,$15.92,0.06,0.378%,651533594.00,United States,,587973,Real Estate,Real Estate Investment Trusts
DX^C,Dynex Capital Inc. 6.900% Series C Fixed-to-Floating Rate Cumulative Redeemable Preferred Stock,$22.05,-0.58,-2.563%,,United States,,5079,,
DXC,DXC Technology Company Common Stock ,$30.31,-0.22,-0.721%,6960838473.00,,,1777487,Technology,EDP Services
DY,Dycom Industries Inc. Common Stock,$93.04,2.01,2.208%,2749515382.00,United States,,156146,Industrials,Water Sewer Pipeline Comm & Power Line Construction
DYFN,Angel Oak Dynamic Financial Strategies Income Term Trust Common Shares of Beneficial Interest,$17.03,0.04,0.235%,69056650.00,,2020,13867,Finance,Finance/Investors Services
